Parsed test spec with 3 sessions

starting permutation: begin_1 begin_2 select_1 delete_1 select_1 select_2 delete_2 select_1 commit_1 select_1 select_2 commit_2 select_1 select_2
step begin_1: BEGIN;
step begin_2: BEGIN;
step select_1: 
					SELECT * FROM o_test_1 ORDER BY val_1;
					SELECT orioledb_tbl_structure('o_test_1'::regclass,
												  'nue');

val_1|val_2
-----+-----
    1|  101
    2|  102
    3|  103
    4|  104
    5|  105
(5 rows)

orioledb_tbl_structure                                                                                                                                                                                                                                                                                                                                                                                                                                                                                      
------------------------------------------------------------------------------------------------------------------------------------------------------------------------------------------------------------------------------------------------------------------------------------------------------------------------------------------------------------------------------------------------------------------------------------------------------------------------------------------------------------
Index o_test_1_pkey contents
Page 0: level = 0, maxKeyLen = 8, nVacatedBytes = 0
state = free, datoid equal, relnode equal, ix_type = primary, dirty
    Leftmost, Rightmost
  Chunk 0: offset = 0, location = 256, hikey location = 64
    Item 0: offset = 272, tuple = ('1', '101')
    Item 1: offset = 296, tuple = ('2', '102')
    Item 2: offset = 320, tuple = ('3', '103')
    Item 3: offset = 344, tuple = ('4', '104')
    Item 4: offset = 368, tuple = ('5', '105')

Index toast: not loaded

(1 row)

step delete_1: DELETE FROM o_test_1 WHERE val_1 = 1;
step select_1: 
					SELECT * FROM o_test_1 ORDER BY val_1;
					SELECT orioledb_tbl_structure('o_test_1'::regclass,
												  'nue');

val_1|val_2
-----+-----
    2|  102
    3|  103
    4|  104
    5|  105
(4 rows)

orioledb_tbl_structure                                                                                                                                                                                                                                                                                                                                                                                                                                                                                                                                                   
-------------------------------------------------------------------------------------------------------------------------------------------------------------------------------------------------------------------------------------------------------------------------------------------------------------------------------------------------------------------------------------------------------------------------------------------------------------------------------------------------------------------------------------------------------------------------
Index o_test_1_pkey contents
Page 0: level = 0, maxKeyLen = 8, nVacatedBytes = 24
state = free, datoid equal, relnode equal, ix_type = primary, dirty
    Leftmost, Rightmost
  Chunk 0: offset = 0, location = 256, hikey location = 64
    Item 0: mode = update, deleted, undoLocation = 0, offset = 272, tuple = ('1', '101')
      Undo item: 
    Item 1: offset = 296, tuple = ('2', '102')
    Item 2: offset = 320, tuple = ('3', '103')
    Item 3: offset = 344, tuple = ('4', '104')
    Item 4: offset = 368, tuple = ('5', '105')

Index toast: not loaded

(1 row)

step select_2: 
					SELECT * FROM o_test_1 ORDER BY val_1;
					SELECT orioledb_tbl_structure('o_test_1'::regclass,
												  'nue');

val_1|val_2
-----+-----
    1|  101
    2|  102
    3|  103
    4|  104
    5|  105
(5 rows)

orioledb_tbl_structure                                                                                                                                                                                                                                                                                                                                                                                                                                                                                                                                                   
-------------------------------------------------------------------------------------------------------------------------------------------------------------------------------------------------------------------------------------------------------------------------------------------------------------------------------------------------------------------------------------------------------------------------------------------------------------------------------------------------------------------------------------------------------------------------
Index o_test_1_pkey contents
Page 0: level = 0, maxKeyLen = 8, nVacatedBytes = 24
state = free, datoid equal, relnode equal, ix_type = primary, dirty
    Leftmost, Rightmost
  Chunk 0: offset = 0, location = 256, hikey location = 64
    Item 0: mode = update, deleted, undoLocation = 0, offset = 272, tuple = ('1', '101')
      Undo item: 
    Item 1: offset = 296, tuple = ('2', '102')
    Item 2: offset = 320, tuple = ('3', '103')
    Item 3: offset = 344, tuple = ('4', '104')
    Item 4: offset = 368, tuple = ('5', '105')

Index toast: not loaded

(1 row)

step delete_2: DELETE FROM o_test_1 WHERE val_1 = 1; <waiting ...>
step select_1: 
					SELECT * FROM o_test_1 ORDER BY val_1;
					SELECT orioledb_tbl_structure('o_test_1'::regclass,
												  'nue');

val_1|val_2
-----+-----
    2|  102
    3|  103
    4|  104
    5|  105
(4 rows)

orioledb_tbl_structure                                                                                                                                                                                                                                                                                                                                                                                                                                                                                                                                                   
-------------------------------------------------------------------------------------------------------------------------------------------------------------------------------------------------------------------------------------------------------------------------------------------------------------------------------------------------------------------------------------------------------------------------------------------------------------------------------------------------------------------------------------------------------------------------
Index o_test_1_pkey contents
Page 0: level = 0, maxKeyLen = 8, nVacatedBytes = 24
state = free, datoid equal, relnode equal, ix_type = primary, dirty
    Leftmost, Rightmost
  Chunk 0: offset = 0, location = 256, hikey location = 64
    Item 0: mode = update, deleted, undoLocation = 0, offset = 272, tuple = ('1', '101')
      Undo item: 
    Item 1: offset = 296, tuple = ('2', '102')
    Item 2: offset = 320, tuple = ('3', '103')
    Item 3: offset = 344, tuple = ('4', '104')
    Item 4: offset = 368, tuple = ('5', '105')

Index toast: not loaded

(1 row)

step commit_1: COMMIT;
step delete_2: <... completed>
step select_1: 
					SELECT * FROM o_test_1 ORDER BY val_1;
					SELECT orioledb_tbl_structure('o_test_1'::regclass,
												  'nue');

val_1|val_2
-----+-----
    2|  102
    3|  103
    4|  104
    5|  105
(4 rows)

orioledb_tbl_structure                                                                                                                                                                                                                                                                                                                                                                                                                                                                                                
----------------------------------------------------------------------------------------------------------------------------------------------------------------------------------------------------------------------------------------------------------------------------------------------------------------------------------------------------------------------------------------------------------------------------------------------------------------------------------------------------------------------
Index o_test_1_pkey contents
Page 0: level = 0, maxKeyLen = 8, nVacatedBytes = 24
state = free, datoid equal, relnode equal, ix_type = primary, dirty
    Leftmost, Rightmost
  Chunk 0: offset = 0, location = 256, hikey location = 64
    Item 0: deleted, offset = 272, tuple = ('1', '101')
    Item 1: offset = 296, tuple = ('2', '102')
    Item 2: offset = 320, tuple = ('3', '103')
    Item 3: offset = 344, tuple = ('4', '104')
    Item 4: offset = 368, tuple = ('5', '105')

Index toast: not loaded

(1 row)

step select_2: 
					SELECT * FROM o_test_1 ORDER BY val_1;
					SELECT orioledb_tbl_structure('o_test_1'::regclass,
												  'nue');

val_1|val_2
-----+-----
    2|  102
    3|  103
    4|  104
    5|  105
(4 rows)

orioledb_tbl_structure                                                                                                                                                                                                                                                                                                                                                                                                                                                                                                
----------------------------------------------------------------------------------------------------------------------------------------------------------------------------------------------------------------------------------------------------------------------------------------------------------------------------------------------------------------------------------------------------------------------------------------------------------------------------------------------------------------------
Index o_test_1_pkey contents
Page 0: level = 0, maxKeyLen = 8, nVacatedBytes = 24
state = free, datoid equal, relnode equal, ix_type = primary, dirty
    Leftmost, Rightmost
  Chunk 0: offset = 0, location = 256, hikey location = 64
    Item 0: deleted, offset = 272, tuple = ('1', '101')
    Item 1: offset = 296, tuple = ('2', '102')
    Item 2: offset = 320, tuple = ('3', '103')
    Item 3: offset = 344, tuple = ('4', '104')
    Item 4: offset = 368, tuple = ('5', '105')

Index toast: not loaded

(1 row)

step commit_2: COMMIT;
step select_1: 
					SELECT * FROM o_test_1 ORDER BY val_1;
					SELECT orioledb_tbl_structure('o_test_1'::regclass,
												  'nue');

val_1|val_2
-----+-----
    2|  102
    3|  103
    4|  104
    5|  105
(4 rows)

orioledb_tbl_structure                                                                                                                                                                                                                                                                                                                                                                                                                                                                                                
----------------------------------------------------------------------------------------------------------------------------------------------------------------------------------------------------------------------------------------------------------------------------------------------------------------------------------------------------------------------------------------------------------------------------------------------------------------------------------------------------------------------
Index o_test_1_pkey contents
Page 0: level = 0, maxKeyLen = 8, nVacatedBytes = 24
state = free, datoid equal, relnode equal, ix_type = primary, dirty
    Leftmost, Rightmost
  Chunk 0: offset = 0, location = 256, hikey location = 64
    Item 0: deleted, offset = 272, tuple = ('1', '101')
    Item 1: offset = 296, tuple = ('2', '102')
    Item 2: offset = 320, tuple = ('3', '103')
    Item 3: offset = 344, tuple = ('4', '104')
    Item 4: offset = 368, tuple = ('5', '105')

Index toast: not loaded

(1 row)

step select_2: 
					SELECT * FROM o_test_1 ORDER BY val_1;
					SELECT orioledb_tbl_structure('o_test_1'::regclass,
												  'nue');

val_1|val_2
-----+-----
    2|  102
    3|  103
    4|  104
    5|  105
(4 rows)

orioledb_tbl_structure                                                                                                                                                                                                                                                                                                                                                                                                                                                                                                
----------------------------------------------------------------------------------------------------------------------------------------------------------------------------------------------------------------------------------------------------------------------------------------------------------------------------------------------------------------------------------------------------------------------------------------------------------------------------------------------------------------------
Index o_test_1_pkey contents
Page 0: level = 0, maxKeyLen = 8, nVacatedBytes = 24
state = free, datoid equal, relnode equal, ix_type = primary, dirty
    Leftmost, Rightmost
  Chunk 0: offset = 0, location = 256, hikey location = 64
    Item 0: deleted, offset = 272, tuple = ('1', '101')
    Item 1: offset = 296, tuple = ('2', '102')
    Item 2: offset = 320, tuple = ('3', '103')
    Item 3: offset = 344, tuple = ('4', '104')
    Item 4: offset = 368, tuple = ('5', '105')

Index toast: not loaded

(1 row)


starting permutation: begin_1 begin_2 select_1 update_1_2 select_1 select_2 update_2_2 commit_1 select_1 select_2 commit_2 select_1 select_2
step begin_1: BEGIN;
step begin_2: BEGIN;
step select_1: 
					SELECT * FROM o_test_1 ORDER BY val_1;
					SELECT orioledb_tbl_structure('o_test_1'::regclass,
												  'nue');

val_1|val_2
-----+-----
    1|  101
    2|  102
    3|  103
    4|  104
    5|  105
(5 rows)

orioledb_tbl_structure                                                                                                                                                                                                                                                                                                                                                                                                                                                                                      
------------------------------------------------------------------------------------------------------------------------------------------------------------------------------------------------------------------------------------------------------------------------------------------------------------------------------------------------------------------------------------------------------------------------------------------------------------------------------------------------------------
Index o_test_1_pkey contents
Page 0: level = 0, maxKeyLen = 8, nVacatedBytes = 0
state = free, datoid equal, relnode equal, ix_type = primary, dirty
    Leftmost, Rightmost
  Chunk 0: offset = 0, location = 256, hikey location = 64
    Item 0: offset = 272, tuple = ('1', '101')
    Item 1: offset = 296, tuple = ('2', '102')
    Item 2: offset = 320, tuple = ('3', '103')
    Item 3: offset = 344, tuple = ('4', '104')
    Item 4: offset = 368, tuple = ('5', '105')

Index toast: not loaded

(1 row)

step update_1_2: UPDATE o_test_1 SET val_2 = val_2 + 10 WHERE val_1 = 1;
step select_1: 
					SELECT * FROM o_test_1 ORDER BY val_1;
					SELECT orioledb_tbl_structure('o_test_1'::regclass,
												  'nue');

val_1|val_2
-----+-----
    1|  111
    2|  102
    3|  103
    4|  104
    5|  105
(5 rows)

orioledb_tbl_structure                                                                                                                                                                                                                                                                                                                                                                                                                                                                                                                                                                  
----------------------------------------------------------------------------------------------------------------------------------------------------------------------------------------------------------------------------------------------------------------------------------------------------------------------------------------------------------------------------------------------------------------------------------------------------------------------------------------------------------------------------------------------------------------------------------------
Index o_test_1_pkey contents
Page 0: level = 0, maxKeyLen = 8, nVacatedBytes = 0
state = free, datoid equal, relnode equal, ix_type = primary, dirty
    Leftmost, Rightmost
  Chunk 0: offset = 0, location = 256, hikey location = 64
    Item 0: mode = noKeyUpdate, undoLocation = 0, offset = 272, tuple = ('1', '111')
      Undo item: tuple = ('1', '101')
    Item 1: offset = 296, tuple = ('2', '102')
    Item 2: offset = 320, tuple = ('3', '103')
    Item 3: offset = 344, tuple = ('4', '104')
    Item 4: offset = 368, tuple = ('5', '105')

Index toast: not loaded

(1 row)

step select_2: 
					SELECT * FROM o_test_1 ORDER BY val_1;
					SELECT orioledb_tbl_structure('o_test_1'::regclass,
												  'nue');

val_1|val_2
-----+-----
    1|  101
    2|  102
    3|  103
    4|  104
    5|  105
(5 rows)

orioledb_tbl_structure                                                                                                                                                                                                                                                                                                                                                                                                                                                                                                                                                                  
----------------------------------------------------------------------------------------------------------------------------------------------------------------------------------------------------------------------------------------------------------------------------------------------------------------------------------------------------------------------------------------------------------------------------------------------------------------------------------------------------------------------------------------------------------------------------------------
Index o_test_1_pkey contents
Page 0: level = 0, maxKeyLen = 8, nVacatedBytes = 0
state = free, datoid equal, relnode equal, ix_type = primary, dirty
    Leftmost, Rightmost
  Chunk 0: offset = 0, location = 256, hikey location = 64
    Item 0: mode = noKeyUpdate, undoLocation = 0, offset = 272, tuple = ('1', '111')
      Undo item: tuple = ('1', '101')
    Item 1: offset = 296, tuple = ('2', '102')
    Item 2: offset = 320, tuple = ('3', '103')
    Item 3: offset = 344, tuple = ('4', '104')
    Item 4: offset = 368, tuple = ('5', '105')

Index toast: not loaded

(1 row)

step update_2_2: UPDATE o_test_1 SET val_2 = val_2 + 20 WHERE val_1 = 1; <waiting ...>
step commit_1: COMMIT;
step update_2_2: <... completed>
step select_1: 
					SELECT * FROM o_test_1 ORDER BY val_1;
					SELECT orioledb_tbl_structure('o_test_1'::regclass,
												  'nue');

val_1|val_2
-----+-----
    1|  111
    2|  102
    3|  103
    4|  104
    5|  105
(5 rows)

orioledb_tbl_structure                                                                                                                                                                                                                                                                                                                                                                                                                                                                                                                                                                  
----------------------------------------------------------------------------------------------------------------------------------------------------------------------------------------------------------------------------------------------------------------------------------------------------------------------------------------------------------------------------------------------------------------------------------------------------------------------------------------------------------------------------------------------------------------------------------------
Index o_test_1_pkey contents
Page 0: level = 0, maxKeyLen = 8, nVacatedBytes = 0
state = free, datoid equal, relnode equal, ix_type = primary, dirty
    Leftmost, Rightmost
  Chunk 0: offset = 0, location = 256, hikey location = 64
    Item 0: mode = noKeyUpdate, undoLocation = 0, offset = 272, tuple = ('1', '131')
      Undo item: tuple = ('1', '111')
    Item 1: offset = 296, tuple = ('2', '102')
    Item 2: offset = 320, tuple = ('3', '103')
    Item 3: offset = 344, tuple = ('4', '104')
    Item 4: offset = 368, tuple = ('5', '105')

Index toast: not loaded

(1 row)

step select_2: 
					SELECT * FROM o_test_1 ORDER BY val_1;
					SELECT orioledb_tbl_structure('o_test_1'::regclass,
												  'nue');

val_1|val_2
-----+-----
    1|  131
    2|  102
    3|  103
    4|  104
    5|  105
(5 rows)

orioledb_tbl_structure                                                                                                                                                                                                                                                                                                                                                                                                                                                                                                                                                                  
----------------------------------------------------------------------------------------------------------------------------------------------------------------------------------------------------------------------------------------------------------------------------------------------------------------------------------------------------------------------------------------------------------------------------------------------------------------------------------------------------------------------------------------------------------------------------------------
Index o_test_1_pkey contents
Page 0: level = 0, maxKeyLen = 8, nVacatedBytes = 0
state = free, datoid equal, relnode equal, ix_type = primary, dirty
    Leftmost, Rightmost
  Chunk 0: offset = 0, location = 256, hikey location = 64
    Item 0: mode = noKeyUpdate, undoLocation = 0, offset = 272, tuple = ('1', '131')
      Undo item: tuple = ('1', '111')
    Item 1: offset = 296, tuple = ('2', '102')
    Item 2: offset = 320, tuple = ('3', '103')
    Item 3: offset = 344, tuple = ('4', '104')
    Item 4: offset = 368, tuple = ('5', '105')

Index toast: not loaded

(1 row)

step commit_2: COMMIT;
step select_1: 
					SELECT * FROM o_test_1 ORDER BY val_1;
					SELECT orioledb_tbl_structure('o_test_1'::regclass,
												  'nue');

val_1|val_2
-----+-----
    1|  131
    2|  102
    3|  103
    4|  104
    5|  105
(5 rows)

orioledb_tbl_structure                                                                                                                                                                                                                                                                                                                                                                                                                                                                                      
------------------------------------------------------------------------------------------------------------------------------------------------------------------------------------------------------------------------------------------------------------------------------------------------------------------------------------------------------------------------------------------------------------------------------------------------------------------------------------------------------------
Index o_test_1_pkey contents
Page 0: level = 0, maxKeyLen = 8, nVacatedBytes = 0
state = free, datoid equal, relnode equal, ix_type = primary, dirty
    Leftmost, Rightmost
  Chunk 0: offset = 0, location = 256, hikey location = 64
    Item 0: offset = 272, tuple = ('1', '131')
    Item 1: offset = 296, tuple = ('2', '102')
    Item 2: offset = 320, tuple = ('3', '103')
    Item 3: offset = 344, tuple = ('4', '104')
    Item 4: offset = 368, tuple = ('5', '105')

Index toast: not loaded

(1 row)

step select_2: 
					SELECT * FROM o_test_1 ORDER BY val_1;
					SELECT orioledb_tbl_structure('o_test_1'::regclass,
												  'nue');

val_1|val_2
-----+-----
    1|  131
    2|  102
    3|  103
    4|  104
    5|  105
(5 rows)

orioledb_tbl_structure                                                                                                                                                                                                                                                                                                                                                                                                                                                                                      
------------------------------------------------------------------------------------------------------------------------------------------------------------------------------------------------------------------------------------------------------------------------------------------------------------------------------------------------------------------------------------------------------------------------------------------------------------------------------------------------------------
Index o_test_1_pkey contents
Page 0: level = 0, maxKeyLen = 8, nVacatedBytes = 0
state = free, datoid equal, relnode equal, ix_type = primary, dirty
    Leftmost, Rightmost
  Chunk 0: offset = 0, location = 256, hikey location = 64
    Item 0: offset = 272, tuple = ('1', '131')
    Item 1: offset = 296, tuple = ('2', '102')
    Item 2: offset = 320, tuple = ('3', '103')
    Item 3: offset = 344, tuple = ('4', '104')
    Item 4: offset = 368, tuple = ('5', '105')

Index toast: not loaded

(1 row)


starting permutation: begin_1 begin_2 select_1 savepoint_2 update_1_2 select_1 select_2 update_2_2 commit_1 select_1 select_2 rollback_to_savepoint_2 select_1 select_2 commit_2 select_1 select_2
step begin_1: BEGIN;
step begin_2: BEGIN;
step select_1: 
					SELECT * FROM o_test_1 ORDER BY val_1;
					SELECT orioledb_tbl_structure('o_test_1'::regclass,
												  'nue');

val_1|val_2
-----+-----
    1|  101
    2|  102
    3|  103
    4|  104
    5|  105
(5 rows)

orioledb_tbl_structure                                                                                                                                                                                                                                                                                                                                                                                                                                                                                      
------------------------------------------------------------------------------------------------------------------------------------------------------------------------------------------------------------------------------------------------------------------------------------------------------------------------------------------------------------------------------------------------------------------------------------------------------------------------------------------------------------
Index o_test_1_pkey contents
Page 0: level = 0, maxKeyLen = 8, nVacatedBytes = 0
state = free, datoid equal, relnode equal, ix_type = primary, dirty
    Leftmost, Rightmost
  Chunk 0: offset = 0, location = 256, hikey location = 64
    Item 0: offset = 272, tuple = ('1', '101')
    Item 1: offset = 296, tuple = ('2', '102')
    Item 2: offset = 320, tuple = ('3', '103')
    Item 3: offset = 344, tuple = ('4', '104')
    Item 4: offset = 368, tuple = ('5', '105')

Index toast: not loaded

(1 row)

step savepoint_2: SAVEPOINT s1;
step update_1_2: UPDATE o_test_1 SET val_2 = val_2 + 10 WHERE val_1 = 1;
step select_1: 
					SELECT * FROM o_test_1 ORDER BY val_1;
					SELECT orioledb_tbl_structure('o_test_1'::regclass,
												  'nue');

val_1|val_2
-----+-----
    1|  111
    2|  102
    3|  103
    4|  104
    5|  105
(5 rows)

orioledb_tbl_structure                                                                                                                                                                                                                                                                                                                                                                                                                                                                                                                                                                  
----------------------------------------------------------------------------------------------------------------------------------------------------------------------------------------------------------------------------------------------------------------------------------------------------------------------------------------------------------------------------------------------------------------------------------------------------------------------------------------------------------------------------------------------------------------------------------------
Index o_test_1_pkey contents
Page 0: level = 0, maxKeyLen = 8, nVacatedBytes = 0
state = free, datoid equal, relnode equal, ix_type = primary, dirty
    Leftmost, Rightmost
  Chunk 0: offset = 0, location = 256, hikey location = 64
    Item 0: mode = noKeyUpdate, undoLocation = 0, offset = 272, tuple = ('1', '111')
      Undo item: tuple = ('1', '101')
    Item 1: offset = 296, tuple = ('2', '102')
    Item 2: offset = 320, tuple = ('3', '103')
    Item 3: offset = 344, tuple = ('4', '104')
    Item 4: offset = 368, tuple = ('5', '105')

Index toast: not loaded

(1 row)

step select_2: 
					SELECT * FROM o_test_1 ORDER BY val_1;
					SELECT orioledb_tbl_structure('o_test_1'::regclass,
												  'nue');

val_1|val_2
-----+-----
    1|  101
    2|  102
    3|  103
    4|  104
    5|  105
(5 rows)

orioledb_tbl_structure                                                                                                                                                                                                                                                                                                                                                                                                                                                                                                                                                                  
----------------------------------------------------------------------------------------------------------------------------------------------------------------------------------------------------------------------------------------------------------------------------------------------------------------------------------------------------------------------------------------------------------------------------------------------------------------------------------------------------------------------------------------------------------------------------------------
Index o_test_1_pkey contents
Page 0: level = 0, maxKeyLen = 8, nVacatedBytes = 0
state = free, datoid equal, relnode equal, ix_type = primary, dirty
    Leftmost, Rightmost
  Chunk 0: offset = 0, location = 256, hikey location = 64
    Item 0: mode = noKeyUpdate, undoLocation = 0, offset = 272, tuple = ('1', '111')
      Undo item: tuple = ('1', '101')
    Item 1: offset = 296, tuple = ('2', '102')
    Item 2: offset = 320, tuple = ('3', '103')
    Item 3: offset = 344, tuple = ('4', '104')
    Item 4: offset = 368, tuple = ('5', '105')

Index toast: not loaded

(1 row)

step update_2_2: UPDATE o_test_1 SET val_2 = val_2 + 20 WHERE val_1 = 1; <waiting ...>
step commit_1: COMMIT;
step update_2_2: <... completed>
step select_1: 
					SELECT * FROM o_test_1 ORDER BY val_1;
					SELECT orioledb_tbl_structure('o_test_1'::regclass,
												  'nue');

val_1|val_2
-----+-----
    1|  111
    2|  102
    3|  103
    4|  104
    5|  105
(5 rows)

orioledb_tbl_structure                                                                                                                                                                                                                                                                                                                                                                                                                                                                                                                                                                                    
----------------------------------------------------------------------------------------------------------------------------------------------------------------------------------------------------------------------------------------------------------------------------------------------------------------------------------------------------------------------------------------------------------------------------------------------------------------------------------------------------------------------------------------------------------------------------------------------------------
Index o_test_1_pkey contents
Page 0: level = 0, maxKeyLen = 8, nVacatedBytes = 0
state = free, datoid equal, relnode equal, ix_type = primary, dirty
    Leftmost, Rightmost
  Chunk 0: offset = 0, location = 256, hikey location = 64
    Item 0: mode = noKeyUpdate, undoLocation = 1, offset = 272, tuple = ('1', '131')
      Undo item: undoLocation = 0, tuple = ('1', '111')
    Item 1: offset = 296, tuple = ('2', '102')
    Item 2: offset = 320, tuple = ('3', '103')
    Item 3: offset = 344, tuple = ('4', '104')
    Item 4: offset = 368, tuple = ('5', '105')

Index toast: not loaded

(1 row)

step select_2: 
					SELECT * FROM o_test_1 ORDER BY val_1;
					SELECT orioledb_tbl_structure('o_test_1'::regclass,
												  'nue');

val_1|val_2
-----+-----
    1|  131
    2|  102
    3|  103
    4|  104
    5|  105
(5 rows)

orioledb_tbl_structure                                                                                                                                                                                                                                                                                                                                                                                                                                                                                                                                                                                    
----------------------------------------------------------------------------------------------------------------------------------------------------------------------------------------------------------------------------------------------------------------------------------------------------------------------------------------------------------------------------------------------------------------------------------------------------------------------------------------------------------------------------------------------------------------------------------------------------------
Index o_test_1_pkey contents
Page 0: level = 0, maxKeyLen = 8, nVacatedBytes = 0
state = free, datoid equal, relnode equal, ix_type = primary, dirty
    Leftmost, Rightmost
  Chunk 0: offset = 0, location = 256, hikey location = 64
    Item 0: mode = noKeyUpdate, undoLocation = 1, offset = 272, tuple = ('1', '131')
      Undo item: undoLocation = 0, tuple = ('1', '111')
    Item 1: offset = 296, tuple = ('2', '102')
    Item 2: offset = 320, tuple = ('3', '103')
    Item 3: offset = 344, tuple = ('4', '104')
    Item 4: offset = 368, tuple = ('5', '105')

Index toast: not loaded

(1 row)

step rollback_to_savepoint_2: ROLLBACK TO s1;
step select_1: 
					SELECT * FROM o_test_1 ORDER BY val_1;
					SELECT orioledb_tbl_structure('o_test_1'::regclass,
												  'nue');

val_1|val_2
-----+-----
    1|  111
    2|  102
    3|  103
    4|  104
    5|  105
(5 rows)

orioledb_tbl_structure                                                                                                                                                                                                                                                                                                                                                                                                                                                                                                        
------------------------------------------------------------------------------------------------------------------------------------------------------------------------------------------------------------------------------------------------------------------------------------------------------------------------------------------------------------------------------------------------------------------------------------------------------------------------------------------------------------------------------
Index o_test_1_pkey contents
Page 0: level = 0, maxKeyLen = 8, nVacatedBytes = 0
state = free, datoid equal, relnode equal, ix_type = primary, dirty
    Leftmost, Rightmost
  Chunk 0: offset = 0, location = 256, hikey location = 64
    Item 0: undoLocation = 0, offset = 272, tuple = ('1', '111')
    Item 1: offset = 296, tuple = ('2', '102')
    Item 2: offset = 320, tuple = ('3', '103')
    Item 3: offset = 344, tuple = ('4', '104')
    Item 4: offset = 368, tuple = ('5', '105')

Index toast: not loaded

(1 row)

step select_2: 
					SELECT * FROM o_test_1 ORDER BY val_1;
					SELECT orioledb_tbl_structure('o_test_1'::regclass,
												  'nue');

val_1|val_2
-----+-----
    1|  111
    2|  102
    3|  103
    4|  104
    5|  105
(5 rows)

orioledb_tbl_structure                                                                                                                                                                                                                                                                                                                                                                                                                                                                                                        
------------------------------------------------------------------------------------------------------------------------------------------------------------------------------------------------------------------------------------------------------------------------------------------------------------------------------------------------------------------------------------------------------------------------------------------------------------------------------------------------------------------------------
Index o_test_1_pkey contents
Page 0: level = 0, maxKeyLen = 8, nVacatedBytes = 0
state = free, datoid equal, relnode equal, ix_type = primary, dirty
    Leftmost, Rightmost
  Chunk 0: offset = 0, location = 256, hikey location = 64
    Item 0: undoLocation = 0, offset = 272, tuple = ('1', '111')
    Item 1: offset = 296, tuple = ('2', '102')
    Item 2: offset = 320, tuple = ('3', '103')
    Item 3: offset = 344, tuple = ('4', '104')
    Item 4: offset = 368, tuple = ('5', '105')

Index toast: not loaded

(1 row)

step commit_2: COMMIT;
step select_1: 
					SELECT * FROM o_test_1 ORDER BY val_1;
					SELECT orioledb_tbl_structure('o_test_1'::regclass,
												  'nue');

val_1|val_2
-----+-----
    1|  111
    2|  102
    3|  103
    4|  104
    5|  105
(5 rows)

orioledb_tbl_structure                                                                                                                                                                                                                                                                                                                                                                                                                                                                                      
------------------------------------------------------------------------------------------------------------------------------------------------------------------------------------------------------------------------------------------------------------------------------------------------------------------------------------------------------------------------------------------------------------------------------------------------------------------------------------------------------------
Index o_test_1_pkey contents
Page 0: level = 0, maxKeyLen = 8, nVacatedBytes = 0
state = free, datoid equal, relnode equal, ix_type = primary, dirty
    Leftmost, Rightmost
  Chunk 0: offset = 0, location = 256, hikey location = 64
    Item 0: offset = 272, tuple = ('1', '111')
    Item 1: offset = 296, tuple = ('2', '102')
    Item 2: offset = 320, tuple = ('3', '103')
    Item 3: offset = 344, tuple = ('4', '104')
    Item 4: offset = 368, tuple = ('5', '105')

Index toast: not loaded

(1 row)

step select_2: 
					SELECT * FROM o_test_1 ORDER BY val_1;
					SELECT orioledb_tbl_structure('o_test_1'::regclass,
												  'nue');

val_1|val_2
-----+-----
    1|  111
    2|  102
    3|  103
    4|  104
    5|  105
(5 rows)

orioledb_tbl_structure                                                                                                                                                                                                                                                                                                                                                                                                                                                                                      
------------------------------------------------------------------------------------------------------------------------------------------------------------------------------------------------------------------------------------------------------------------------------------------------------------------------------------------------------------------------------------------------------------------------------------------------------------------------------------------------------------
Index o_test_1_pkey contents
Page 0: level = 0, maxKeyLen = 8, nVacatedBytes = 0
state = free, datoid equal, relnode equal, ix_type = primary, dirty
    Leftmost, Rightmost
  Chunk 0: offset = 0, location = 256, hikey location = 64
    Item 0: offset = 272, tuple = ('1', '111')
    Item 1: offset = 296, tuple = ('2', '102')
    Item 2: offset = 320, tuple = ('3', '103')
    Item 3: offset = 344, tuple = ('4', '104')
    Item 4: offset = 368, tuple = ('5', '105')

Index toast: not loaded

(1 row)


starting permutation: begin_1 begin_2 select_1 delete_1 select_1 select_2 update_2 select_1 commit_1 select_1 select_2 commit_2 select_1 select_2
step begin_1: BEGIN;
step begin_2: BEGIN;
step select_1: 
					SELECT * FROM o_test_1 ORDER BY val_1;
					SELECT orioledb_tbl_structure('o_test_1'::regclass,
												  'nue');

val_1|val_2
-----+-----
    1|  101
    2|  102
    3|  103
    4|  104
    5|  105
(5 rows)

orioledb_tbl_structure                                                                                                                                                                                                                                                                                                                                                                                                                                                                                      
------------------------------------------------------------------------------------------------------------------------------------------------------------------------------------------------------------------------------------------------------------------------------------------------------------------------------------------------------------------------------------------------------------------------------------------------------------------------------------------------------------
Index o_test_1_pkey contents
Page 0: level = 0, maxKeyLen = 8, nVacatedBytes = 0
state = free, datoid equal, relnode equal, ix_type = primary, dirty
    Leftmost, Rightmost
  Chunk 0: offset = 0, location = 256, hikey location = 64
    Item 0: offset = 272, tuple = ('1', '101')
    Item 1: offset = 296, tuple = ('2', '102')
    Item 2: offset = 320, tuple = ('3', '103')
    Item 3: offset = 344, tuple = ('4', '104')
    Item 4: offset = 368, tuple = ('5', '105')

Index toast: not loaded

(1 row)

step delete_1: DELETE FROM o_test_1 WHERE val_1 = 1;
step select_1: 
					SELECT * FROM o_test_1 ORDER BY val_1;
					SELECT orioledb_tbl_structure('o_test_1'::regclass,
												  'nue');

val_1|val_2
-----+-----
    2|  102
    3|  103
    4|  104
    5|  105
(4 rows)

orioledb_tbl_structure                                                                                                                                                                                                                                                                                                                                                                                                                                                                                                                                                   
-------------------------------------------------------------------------------------------------------------------------------------------------------------------------------------------------------------------------------------------------------------------------------------------------------------------------------------------------------------------------------------------------------------------------------------------------------------------------------------------------------------------------------------------------------------------------
Index o_test_1_pkey contents
Page 0: level = 0, maxKeyLen = 8, nVacatedBytes = 24
state = free, datoid equal, relnode equal, ix_type = primary, dirty
    Leftmost, Rightmost
  Chunk 0: offset = 0, location = 256, hikey location = 64
    Item 0: mode = update, deleted, undoLocation = 0, offset = 272, tuple = ('1', '101')
      Undo item: 
    Item 1: offset = 296, tuple = ('2', '102')
    Item 2: offset = 320, tuple = ('3', '103')
    Item 3: offset = 344, tuple = ('4', '104')
    Item 4: offset = 368, tuple = ('5', '105')

Index toast: not loaded

(1 row)

step select_2: 
					SELECT * FROM o_test_1 ORDER BY val_1;
					SELECT orioledb_tbl_structure('o_test_1'::regclass,
												  'nue');

val_1|val_2
-----+-----
    1|  101
    2|  102
    3|  103
    4|  104
    5|  105
(5 rows)

orioledb_tbl_structure                                                                                                                                                                                                                                                                                                                                                                                                                                                                                                                                                   
-------------------------------------------------------------------------------------------------------------------------------------------------------------------------------------------------------------------------------------------------------------------------------------------------------------------------------------------------------------------------------------------------------------------------------------------------------------------------------------------------------------------------------------------------------------------------
Index o_test_1_pkey contents
Page 0: level = 0, maxKeyLen = 8, nVacatedBytes = 24
state = free, datoid equal, relnode equal, ix_type = primary, dirty
    Leftmost, Rightmost
  Chunk 0: offset = 0, location = 256, hikey location = 64
    Item 0: mode = update, deleted, undoLocation = 0, offset = 272, tuple = ('1', '101')
      Undo item: 
    Item 1: offset = 296, tuple = ('2', '102')
    Item 2: offset = 320, tuple = ('3', '103')
    Item 3: offset = 344, tuple = ('4', '104')
    Item 4: offset = 368, tuple = ('5', '105')

Index toast: not loaded

(1 row)

step update_2: UPDATE o_test_1 SET val_1 = val_1 + 20 WHERE val_1 = 1; <waiting ...>
step select_1: 
					SELECT * FROM o_test_1 ORDER BY val_1;
					SELECT orioledb_tbl_structure('o_test_1'::regclass,
												  'nue');

val_1|val_2
-----+-----
    2|  102
    3|  103
    4|  104
    5|  105
(4 rows)

orioledb_tbl_structure                                                                                                                                                                                                                                                                                                                                                                                                                                                                                                                                                   
-------------------------------------------------------------------------------------------------------------------------------------------------------------------------------------------------------------------------------------------------------------------------------------------------------------------------------------------------------------------------------------------------------------------------------------------------------------------------------------------------------------------------------------------------------------------------
Index o_test_1_pkey contents
Page 0: level = 0, maxKeyLen = 8, nVacatedBytes = 24
state = free, datoid equal, relnode equal, ix_type = primary, dirty
    Leftmost, Rightmost
  Chunk 0: offset = 0, location = 256, hikey location = 64
    Item 0: mode = update, deleted, undoLocation = 0, offset = 272, tuple = ('1', '101')
      Undo item: 
    Item 1: offset = 296, tuple = ('2', '102')
    Item 2: offset = 320, tuple = ('3', '103')
    Item 3: offset = 344, tuple = ('4', '104')
    Item 4: offset = 368, tuple = ('5', '105')

Index toast: not loaded

(1 row)

step commit_1: COMMIT;
step update_2: <... completed>
step select_1: 
					SELECT * FROM o_test_1 ORDER BY val_1;
					SELECT orioledb_tbl_structure('o_test_1'::regclass,
												  'nue');

val_1|val_2
-----+-----
    2|  102
    3|  103
    4|  104
    5|  105
(4 rows)

orioledb_tbl_structure                                                                                                                                                                                                                                                                                                                                                                                                                                                                                                
----------------------------------------------------------------------------------------------------------------------------------------------------------------------------------------------------------------------------------------------------------------------------------------------------------------------------------------------------------------------------------------------------------------------------------------------------------------------------------------------------------------------
Index o_test_1_pkey contents
Page 0: level = 0, maxKeyLen = 8, nVacatedBytes = 24
state = free, datoid equal, relnode equal, ix_type = primary, dirty
    Leftmost, Rightmost
  Chunk 0: offset = 0, location = 256, hikey location = 64
    Item 0: deleted, offset = 272, tuple = ('1', '101')
    Item 1: offset = 296, tuple = ('2', '102')
    Item 2: offset = 320, tuple = ('3', '103')
    Item 3: offset = 344, tuple = ('4', '104')
    Item 4: offset = 368, tuple = ('5', '105')

Index toast: not loaded

(1 row)

step select_2: 
					SELECT * FROM o_test_1 ORDER BY val_1;
					SELECT orioledb_tbl_structure('o_test_1'::regclass,
												  'nue');

val_1|val_2
-----+-----
    2|  102
    3|  103
    4|  104
    5|  105
(4 rows)

orioledb_tbl_structure                                                                                                                                                                                                                                                                                                                                                                                                                                                                                                
----------------------------------------------------------------------------------------------------------------------------------------------------------------------------------------------------------------------------------------------------------------------------------------------------------------------------------------------------------------------------------------------------------------------------------------------------------------------------------------------------------------------
Index o_test_1_pkey contents
Page 0: level = 0, maxKeyLen = 8, nVacatedBytes = 24
state = free, datoid equal, relnode equal, ix_type = primary, dirty
    Leftmost, Rightmost
  Chunk 0: offset = 0, location = 256, hikey location = 64
    Item 0: deleted, offset = 272, tuple = ('1', '101')
    Item 1: offset = 296, tuple = ('2', '102')
    Item 2: offset = 320, tuple = ('3', '103')
    Item 3: offset = 344, tuple = ('4', '104')
    Item 4: offset = 368, tuple = ('5', '105')

Index toast: not loaded

(1 row)

step commit_2: COMMIT;
step select_1: 
					SELECT * FROM o_test_1 ORDER BY val_1;
					SELECT orioledb_tbl_structure('o_test_1'::regclass,
												  'nue');

val_1|val_2
-----+-----
    2|  102
    3|  103
    4|  104
    5|  105
(4 rows)

orioledb_tbl_structure                                                                                                                                                                                                                                                                                                                                                                                                                                                                                                
----------------------------------------------------------------------------------------------------------------------------------------------------------------------------------------------------------------------------------------------------------------------------------------------------------------------------------------------------------------------------------------------------------------------------------------------------------------------------------------------------------------------
Index o_test_1_pkey contents
Page 0: level = 0, maxKeyLen = 8, nVacatedBytes = 24
state = free, datoid equal, relnode equal, ix_type = primary, dirty
    Leftmost, Rightmost
  Chunk 0: offset = 0, location = 256, hikey location = 64
    Item 0: deleted, offset = 272, tuple = ('1', '101')
    Item 1: offset = 296, tuple = ('2', '102')
    Item 2: offset = 320, tuple = ('3', '103')
    Item 3: offset = 344, tuple = ('4', '104')
    Item 4: offset = 368, tuple = ('5', '105')

Index toast: not loaded

(1 row)

step select_2: 
					SELECT * FROM o_test_1 ORDER BY val_1;
					SELECT orioledb_tbl_structure('o_test_1'::regclass,
												  'nue');

val_1|val_2
-----+-----
    2|  102
    3|  103
    4|  104
    5|  105
(4 rows)

orioledb_tbl_structure                                                                                                                                                                                                                                                                                                                                                                                                                                                                                                
----------------------------------------------------------------------------------------------------------------------------------------------------------------------------------------------------------------------------------------------------------------------------------------------------------------------------------------------------------------------------------------------------------------------------------------------------------------------------------------------------------------------
Index o_test_1_pkey contents
Page 0: level = 0, maxKeyLen = 8, nVacatedBytes = 24
state = free, datoid equal, relnode equal, ix_type = primary, dirty
    Leftmost, Rightmost
  Chunk 0: offset = 0, location = 256, hikey location = 64
    Item 0: deleted, offset = 272, tuple = ('1', '101')
    Item 1: offset = 296, tuple = ('2', '102')
    Item 2: offset = 320, tuple = ('3', '103')
    Item 3: offset = 344, tuple = ('4', '104')
    Item 4: offset = 368, tuple = ('5', '105')

Index toast: not loaded

(1 row)


starting permutation: begin_1 begin_2 select_1 update_1 select_1 select_2 update_2 select_1 commit_1 select_1 select_2 commit_2 select_1 select_2
step begin_1: BEGIN;
step begin_2: BEGIN;
step select_1: 
					SELECT * FROM o_test_1 ORDER BY val_1;
					SELECT orioledb_tbl_structure('o_test_1'::regclass,
												  'nue');

val_1|val_2
-----+-----
    1|  101
    2|  102
    3|  103
    4|  104
    5|  105
(5 rows)

orioledb_tbl_structure                                                                                                                                                                                                                                                                                                                                                                                                                                                                                      
------------------------------------------------------------------------------------------------------------------------------------------------------------------------------------------------------------------------------------------------------------------------------------------------------------------------------------------------------------------------------------------------------------------------------------------------------------------------------------------------------------
Index o_test_1_pkey contents
Page 0: level = 0, maxKeyLen = 8, nVacatedBytes = 0
state = free, datoid equal, relnode equal, ix_type = primary, dirty
    Leftmost, Rightmost
  Chunk 0: offset = 0, location = 256, hikey location = 64
    Item 0: offset = 272, tuple = ('1', '101')
    Item 1: offset = 296, tuple = ('2', '102')
    Item 2: offset = 320, tuple = ('3', '103')
    Item 3: offset = 344, tuple = ('4', '104')
    Item 4: offset = 368, tuple = ('5', '105')

Index toast: not loaded

(1 row)

step update_1: UPDATE o_test_1 SET val_1 = val_1 + 10 WHERE val_1 = 1;
step select_1: 
					SELECT * FROM o_test_1 ORDER BY val_1;
					SELECT orioledb_tbl_structure('o_test_1'::regclass,
												  'nue');

val_1|val_2
-----+-----
    2|  102
    3|  103
    4|  104
    5|  105
   11|  101
(5 rows)

orioledb_tbl_structure                                                                                                                                                                                                                                                                                                                                                                                                                                                                                                                                                                                                                  
----------------------------------------------------------------------------------------------------------------------------------------------------------------------------------------------------------------------------------------------------------------------------------------------------------------------------------------------------------------------------------------------------------------------------------------------------------------------------------------------------------------------------------------------------------------------------------------------------------------------------------------
Index o_test_1_pkey contents
Page 0: level = 0, maxKeyLen = 8, nVacatedBytes = 24
state = free, datoid equal, relnode equal, ix_type = primary, dirty
    Leftmost, Rightmost
  Chunk 0: offset = 0, location = 256, hikey location = 64
    Item 0: mode = update, deleted, undoLocation = 0, offset = 272, tuple = ('1', '101')
      Undo item: 
    Item 1: offset = 296, tuple = ('2', '102')
    Item 2: offset = 320, tuple = ('3', '103')
    Item 3: offset = 344, tuple = ('4', '104')
    Item 4: offset = 368, tuple = ('5', '105')
    Item 5: mode = update, offset = 392, tuple = ('11', '101')

Index toast: not loaded

(1 row)

step select_2: 
					SELECT * FROM o_test_1 ORDER BY val_1;
					SELECT orioledb_tbl_structure('o_test_1'::regclass,
												  'nue');

val_1|val_2
-----+-----
    1|  101
    2|  102
    3|  103
    4|  104
    5|  105
(5 rows)

orioledb_tbl_structure                                                                                                                                                                                                                                                                                                                                                                                                                                                                                                                                                                                                                  
----------------------------------------------------------------------------------------------------------------------------------------------------------------------------------------------------------------------------------------------------------------------------------------------------------------------------------------------------------------------------------------------------------------------------------------------------------------------------------------------------------------------------------------------------------------------------------------------------------------------------------------
Index o_test_1_pkey contents
Page 0: level = 0, maxKeyLen = 8, nVacatedBytes = 24
state = free, datoid equal, relnode equal, ix_type = primary, dirty
    Leftmost, Rightmost
  Chunk 0: offset = 0, location = 256, hikey location = 64
    Item 0: mode = update, deleted, undoLocation = 0, offset = 272, tuple = ('1', '101')
      Undo item: 
    Item 1: offset = 296, tuple = ('2', '102')
    Item 2: offset = 320, tuple = ('3', '103')
    Item 3: offset = 344, tuple = ('4', '104')
    Item 4: offset = 368, tuple = ('5', '105')
    Item 5: mode = update, offset = 392, tuple = ('11', '101')

Index toast: not loaded

(1 row)

step update_2: UPDATE o_test_1 SET val_1 = val_1 + 20 WHERE val_1 = 1; <waiting ...>
step select_1: 
					SELECT * FROM o_test_1 ORDER BY val_1;
					SELECT orioledb_tbl_structure('o_test_1'::regclass,
												  'nue');

val_1|val_2
-----+-----
    2|  102
    3|  103
    4|  104
    5|  105
   11|  101
(5 rows)

orioledb_tbl_structure                                                                                                                                                                                                                                                                                                                                                                                                                                                                                                                                                                                                                  
----------------------------------------------------------------------------------------------------------------------------------------------------------------------------------------------------------------------------------------------------------------------------------------------------------------------------------------------------------------------------------------------------------------------------------------------------------------------------------------------------------------------------------------------------------------------------------------------------------------------------------------
Index o_test_1_pkey contents
Page 0: level = 0, maxKeyLen = 8, nVacatedBytes = 24
state = free, datoid equal, relnode equal, ix_type = primary, dirty
    Leftmost, Rightmost
  Chunk 0: offset = 0, location = 256, hikey location = 64
    Item 0: mode = update, deleted, undoLocation = 0, offset = 272, tuple = ('1', '101')
      Undo item: 
    Item 1: offset = 296, tuple = ('2', '102')
    Item 2: offset = 320, tuple = ('3', '103')
    Item 3: offset = 344, tuple = ('4', '104')
    Item 4: offset = 368, tuple = ('5', '105')
    Item 5: mode = update, offset = 392, tuple = ('11', '101')

Index toast: not loaded

(1 row)

step commit_1: COMMIT;
step update_2: <... completed>
step select_1: 
					SELECT * FROM o_test_1 ORDER BY val_1;
					SELECT orioledb_tbl_structure('o_test_1'::regclass,
												  'nue');

val_1|val_2
-----+-----
    2|  102
    3|  103
    4|  104
    5|  105
   11|  101
(5 rows)

orioledb_tbl_structure                                                                                                                                                                                                                                                                                                                                                                                                                                                                                                                                                
----------------------------------------------------------------------------------------------------------------------------------------------------------------------------------------------------------------------------------------------------------------------------------------------------------------------------------------------------------------------------------------------------------------------------------------------------------------------------------------------------------------------------------------------------------------------
Index o_test_1_pkey contents
Page 0: level = 0, maxKeyLen = 8, nVacatedBytes = 24
state = free, datoid equal, relnode equal, ix_type = primary, dirty
    Leftmost, Rightmost
  Chunk 0: offset = 0, location = 256, hikey location = 64
    Item 0: deleted, offset = 272, tuple = ('1', '101')
    Item 1: offset = 296, tuple = ('2', '102')
    Item 2: offset = 320, tuple = ('3', '103')
    Item 3: offset = 344, tuple = ('4', '104')
    Item 4: offset = 368, tuple = ('5', '105')
    Item 5: offset = 392, tuple = ('11', '101')

Index toast: not loaded

(1 row)

step select_2: 
					SELECT * FROM o_test_1 ORDER BY val_1;
					SELECT orioledb_tbl_structure('o_test_1'::regclass,
												  'nue');

val_1|val_2
-----+-----
    2|  102
    3|  103
    4|  104
    5|  105
   11|  101
(5 rows)

orioledb_tbl_structure                                                                                                                                                                                                                                                                                                                                                                                                                                                                                                                                                
----------------------------------------------------------------------------------------------------------------------------------------------------------------------------------------------------------------------------------------------------------------------------------------------------------------------------------------------------------------------------------------------------------------------------------------------------------------------------------------------------------------------------------------------------------------------
Index o_test_1_pkey contents
Page 0: level = 0, maxKeyLen = 8, nVacatedBytes = 24
state = free, datoid equal, relnode equal, ix_type = primary, dirty
    Leftmost, Rightmost
  Chunk 0: offset = 0, location = 256, hikey location = 64
    Item 0: deleted, offset = 272, tuple = ('1', '101')
    Item 1: offset = 296, tuple = ('2', '102')
    Item 2: offset = 320, tuple = ('3', '103')
    Item 3: offset = 344, tuple = ('4', '104')
    Item 4: offset = 368, tuple = ('5', '105')
    Item 5: offset = 392, tuple = ('11', '101')

Index toast: not loaded

(1 row)

step commit_2: COMMIT;
step select_1: 
					SELECT * FROM o_test_1 ORDER BY val_1;
					SELECT orioledb_tbl_structure('o_test_1'::regclass,
												  'nue');

val_1|val_2
-----+-----
    2|  102
    3|  103
    4|  104
    5|  105
   11|  101
(5 rows)

orioledb_tbl_structure                                                                                                                                                                                                                                                                                                                                                                                                                                                                                                                                                
----------------------------------------------------------------------------------------------------------------------------------------------------------------------------------------------------------------------------------------------------------------------------------------------------------------------------------------------------------------------------------------------------------------------------------------------------------------------------------------------------------------------------------------------------------------------
Index o_test_1_pkey contents
Page 0: level = 0, maxKeyLen = 8, nVacatedBytes = 24
state = free, datoid equal, relnode equal, ix_type = primary, dirty
    Leftmost, Rightmost
  Chunk 0: offset = 0, location = 256, hikey location = 64
    Item 0: deleted, offset = 272, tuple = ('1', '101')
    Item 1: offset = 296, tuple = ('2', '102')
    Item 2: offset = 320, tuple = ('3', '103')
    Item 3: offset = 344, tuple = ('4', '104')
    Item 4: offset = 368, tuple = ('5', '105')
    Item 5: offset = 392, tuple = ('11', '101')

Index toast: not loaded

(1 row)

step select_2: 
					SELECT * FROM o_test_1 ORDER BY val_1;
					SELECT orioledb_tbl_structure('o_test_1'::regclass,
												  'nue');

val_1|val_2
-----+-----
    2|  102
    3|  103
    4|  104
    5|  105
   11|  101
(5 rows)

orioledb_tbl_structure                                                                                                                                                                                                                                                                                                                                                                                                                                                                                                                                                
----------------------------------------------------------------------------------------------------------------------------------------------------------------------------------------------------------------------------------------------------------------------------------------------------------------------------------------------------------------------------------------------------------------------------------------------------------------------------------------------------------------------------------------------------------------------
Index o_test_1_pkey contents
Page 0: level = 0, maxKeyLen = 8, nVacatedBytes = 24
state = free, datoid equal, relnode equal, ix_type = primary, dirty
    Leftmost, Rightmost
  Chunk 0: offset = 0, location = 256, hikey location = 64
    Item 0: deleted, offset = 272, tuple = ('1', '101')
    Item 1: offset = 296, tuple = ('2', '102')
    Item 2: offset = 320, tuple = ('3', '103')
    Item 3: offset = 344, tuple = ('4', '104')
    Item 4: offset = 368, tuple = ('5', '105')
    Item 5: offset = 392, tuple = ('11', '101')

Index toast: not loaded

(1 row)


starting permutation: begin_1 begin_2 select_1 delete_1 select_1 select_2 update_2_2 select_1 commit_1 select_1 select_2 commit_2 select_1 select_2
step begin_1: BEGIN;
step begin_2: BEGIN;
step select_1: 
					SELECT * FROM o_test_1 ORDER BY val_1;
					SELECT orioledb_tbl_structure('o_test_1'::regclass,
												  'nue');

val_1|val_2
-----+-----
    1|  101
    2|  102
    3|  103
    4|  104
    5|  105
(5 rows)

orioledb_tbl_structure                                                                                                                                                                                                                                                                                                                                                                                                                                                                                      
------------------------------------------------------------------------------------------------------------------------------------------------------------------------------------------------------------------------------------------------------------------------------------------------------------------------------------------------------------------------------------------------------------------------------------------------------------------------------------------------------------
Index o_test_1_pkey contents
Page 0: level = 0, maxKeyLen = 8, nVacatedBytes = 0
state = free, datoid equal, relnode equal, ix_type = primary, dirty
    Leftmost, Rightmost
  Chunk 0: offset = 0, location = 256, hikey location = 64
    Item 0: offset = 272, tuple = ('1', '101')
    Item 1: offset = 296, tuple = ('2', '102')
    Item 2: offset = 320, tuple = ('3', '103')
    Item 3: offset = 344, tuple = ('4', '104')
    Item 4: offset = 368, tuple = ('5', '105')

Index toast: not loaded

(1 row)

step delete_1: DELETE FROM o_test_1 WHERE val_1 = 1;
step select_1: 
					SELECT * FROM o_test_1 ORDER BY val_1;
					SELECT orioledb_tbl_structure('o_test_1'::regclass,
												  'nue');

val_1|val_2
-----+-----
    2|  102
    3|  103
    4|  104
    5|  105
(4 rows)

orioledb_tbl_structure                                                                                                                                                                                                                                                                                                                                                                                                                                                                                                                                                   
-------------------------------------------------------------------------------------------------------------------------------------------------------------------------------------------------------------------------------------------------------------------------------------------------------------------------------------------------------------------------------------------------------------------------------------------------------------------------------------------------------------------------------------------------------------------------
Index o_test_1_pkey contents
Page 0: level = 0, maxKeyLen = 8, nVacatedBytes = 24
state = free, datoid equal, relnode equal, ix_type = primary, dirty
    Leftmost, Rightmost
  Chunk 0: offset = 0, location = 256, hikey location = 64
    Item 0: mode = update, deleted, undoLocation = 0, offset = 272, tuple = ('1', '101')
      Undo item: 
    Item 1: offset = 296, tuple = ('2', '102')
    Item 2: offset = 320, tuple = ('3', '103')
    Item 3: offset = 344, tuple = ('4', '104')
    Item 4: offset = 368, tuple = ('5', '105')

Index toast: not loaded

(1 row)

step select_2: 
					SELECT * FROM o_test_1 ORDER BY val_1;
					SELECT orioledb_tbl_structure('o_test_1'::regclass,
												  'nue');

val_1|val_2
-----+-----
    1|  101
    2|  102
    3|  103
    4|  104
    5|  105
(5 rows)

orioledb_tbl_structure                                                                                                                                                                                                                                                                                                                                                                                                                                                                                                                                                   
-------------------------------------------------------------------------------------------------------------------------------------------------------------------------------------------------------------------------------------------------------------------------------------------------------------------------------------------------------------------------------------------------------------------------------------------------------------------------------------------------------------------------------------------------------------------------
Index o_test_1_pkey contents
Page 0: level = 0, maxKeyLen = 8, nVacatedBytes = 24
state = free, datoid equal, relnode equal, ix_type = primary, dirty
    Leftmost, Rightmost
  Chunk 0: offset = 0, location = 256, hikey location = 64
    Item 0: mode = update, deleted, undoLocation = 0, offset = 272, tuple = ('1', '101')
      Undo item: 
    Item 1: offset = 296, tuple = ('2', '102')
    Item 2: offset = 320, tuple = ('3', '103')
    Item 3: offset = 344, tuple = ('4', '104')
    Item 4: offset = 368, tuple = ('5', '105')

Index toast: not loaded

(1 row)

step update_2_2: UPDATE o_test_1 SET val_2 = val_2 + 20 WHERE val_1 = 1; <waiting ...>
step select_1: 
					SELECT * FROM o_test_1 ORDER BY val_1;
					SELECT orioledb_tbl_structure('o_test_1'::regclass,
												  'nue');

val_1|val_2
-----+-----
    2|  102
    3|  103
    4|  104
    5|  105
(4 rows)

orioledb_tbl_structure                                                                                                                                                                                                                                                                                                                                                                                                                                                                                                                                                   
-------------------------------------------------------------------------------------------------------------------------------------------------------------------------------------------------------------------------------------------------------------------------------------------------------------------------------------------------------------------------------------------------------------------------------------------------------------------------------------------------------------------------------------------------------------------------
Index o_test_1_pkey contents
Page 0: level = 0, maxKeyLen = 8, nVacatedBytes = 24
state = free, datoid equal, relnode equal, ix_type = primary, dirty
    Leftmost, Rightmost
  Chunk 0: offset = 0, location = 256, hikey location = 64
    Item 0: mode = update, deleted, undoLocation = 0, offset = 272, tuple = ('1', '101')
      Undo item: 
    Item 1: offset = 296, tuple = ('2', '102')
    Item 2: offset = 320, tuple = ('3', '103')
    Item 3: offset = 344, tuple = ('4', '104')
    Item 4: offset = 368, tuple = ('5', '105')

Index toast: not loaded

(1 row)

step commit_1: COMMIT;
step update_2_2: <... completed>
step select_1: 
					SELECT * FROM o_test_1 ORDER BY val_1;
					SELECT orioledb_tbl_structure('o_test_1'::regclass,
												  'nue');

val_1|val_2
-----+-----
    2|  102
    3|  103
    4|  104
    5|  105
(4 rows)

orioledb_tbl_structure                                                                                                                                                                                                                                                                                                                                                                                                                                                                                                
----------------------------------------------------------------------------------------------------------------------------------------------------------------------------------------------------------------------------------------------------------------------------------------------------------------------------------------------------------------------------------------------------------------------------------------------------------------------------------------------------------------------
Index o_test_1_pkey contents
Page 0: level = 0, maxKeyLen = 8, nVacatedBytes = 24
state = free, datoid equal, relnode equal, ix_type = primary, dirty
    Leftmost, Rightmost
  Chunk 0: offset = 0, location = 256, hikey location = 64
    Item 0: deleted, offset = 272, tuple = ('1', '101')
    Item 1: offset = 296, tuple = ('2', '102')
    Item 2: offset = 320, tuple = ('3', '103')
    Item 3: offset = 344, tuple = ('4', '104')
    Item 4: offset = 368, tuple = ('5', '105')

Index toast: not loaded

(1 row)

step select_2: 
					SELECT * FROM o_test_1 ORDER BY val_1;
					SELECT orioledb_tbl_structure('o_test_1'::regclass,
												  'nue');

val_1|val_2
-----+-----
    2|  102
    3|  103
    4|  104
    5|  105
(4 rows)

orioledb_tbl_structure                                                                                                                                                                                                                                                                                                                                                                                                                                                                                                
----------------------------------------------------------------------------------------------------------------------------------------------------------------------------------------------------------------------------------------------------------------------------------------------------------------------------------------------------------------------------------------------------------------------------------------------------------------------------------------------------------------------
Index o_test_1_pkey contents
Page 0: level = 0, maxKeyLen = 8, nVacatedBytes = 24
state = free, datoid equal, relnode equal, ix_type = primary, dirty
    Leftmost, Rightmost
  Chunk 0: offset = 0, location = 256, hikey location = 64
    Item 0: deleted, offset = 272, tuple = ('1', '101')
    Item 1: offset = 296, tuple = ('2', '102')
    Item 2: offset = 320, tuple = ('3', '103')
    Item 3: offset = 344, tuple = ('4', '104')
    Item 4: offset = 368, tuple = ('5', '105')

Index toast: not loaded

(1 row)

step commit_2: COMMIT;
step select_1: 
					SELECT * FROM o_test_1 ORDER BY val_1;
					SELECT orioledb_tbl_structure('o_test_1'::regclass,
												  'nue');

val_1|val_2
-----+-----
    2|  102
    3|  103
    4|  104
    5|  105
(4 rows)

orioledb_tbl_structure                                                                                                                                                                                                                                                                                                                                                                                                                                                                                                
----------------------------------------------------------------------------------------------------------------------------------------------------------------------------------------------------------------------------------------------------------------------------------------------------------------------------------------------------------------------------------------------------------------------------------------------------------------------------------------------------------------------
Index o_test_1_pkey contents
Page 0: level = 0, maxKeyLen = 8, nVacatedBytes = 24
state = free, datoid equal, relnode equal, ix_type = primary, dirty
    Leftmost, Rightmost
  Chunk 0: offset = 0, location = 256, hikey location = 64
    Item 0: deleted, offset = 272, tuple = ('1', '101')
    Item 1: offset = 296, tuple = ('2', '102')
    Item 2: offset = 320, tuple = ('3', '103')
    Item 3: offset = 344, tuple = ('4', '104')
    Item 4: offset = 368, tuple = ('5', '105')

Index toast: not loaded

(1 row)

step select_2: 
					SELECT * FROM o_test_1 ORDER BY val_1;
					SELECT orioledb_tbl_structure('o_test_1'::regclass,
												  'nue');

val_1|val_2
-----+-----
    2|  102
    3|  103
    4|  104
    5|  105
(4 rows)

orioledb_tbl_structure                                                                                                                                                                                                                                                                                                                                                                                                                                                                                                
----------------------------------------------------------------------------------------------------------------------------------------------------------------------------------------------------------------------------------------------------------------------------------------------------------------------------------------------------------------------------------------------------------------------------------------------------------------------------------------------------------------------
Index o_test_1_pkey contents
Page 0: level = 0, maxKeyLen = 8, nVacatedBytes = 24
state = free, datoid equal, relnode equal, ix_type = primary, dirty
    Leftmost, Rightmost
  Chunk 0: offset = 0, location = 256, hikey location = 64
    Item 0: deleted, offset = 272, tuple = ('1', '101')
    Item 1: offset = 296, tuple = ('2', '102')
    Item 2: offset = 320, tuple = ('3', '103')
    Item 3: offset = 344, tuple = ('4', '104')
    Item 4: offset = 368, tuple = ('5', '105')

Index toast: not loaded

(1 row)


starting permutation: begin_1 begin_2 select_1 update_1_3 select_1 select_2 update_2_3 select_1 commit_1 select_1 select_2 commit_2 select_1 select_2
step begin_1: BEGIN;
step begin_2: BEGIN;
step select_1: 
					SELECT * FROM o_test_1 ORDER BY val_1;
					SELECT orioledb_tbl_structure('o_test_1'::regclass,
												  'nue');

val_1|val_2
-----+-----
    1|  101
    2|  102
    3|  103
    4|  104
    5|  105
(5 rows)

orioledb_tbl_structure                                                                                                                                                                                                                                                                                                                                                                                                                                                                                      
------------------------------------------------------------------------------------------------------------------------------------------------------------------------------------------------------------------------------------------------------------------------------------------------------------------------------------------------------------------------------------------------------------------------------------------------------------------------------------------------------------
Index o_test_1_pkey contents
Page 0: level = 0, maxKeyLen = 8, nVacatedBytes = 0
state = free, datoid equal, relnode equal, ix_type = primary, dirty
    Leftmost, Rightmost
  Chunk 0: offset = 0, location = 256, hikey location = 64
    Item 0: offset = 272, tuple = ('1', '101')
    Item 1: offset = 296, tuple = ('2', '102')
    Item 2: offset = 320, tuple = ('3', '103')
    Item 3: offset = 344, tuple = ('4', '104')
    Item 4: offset = 368, tuple = ('5', '105')

Index toast: not loaded

(1 row)

step update_1_3: UPDATE o_test_1 SET val_1 = val_1 + 10 WHERE val_1 < 10;
step select_1: 
					SELECT * FROM o_test_1 ORDER BY val_1;
					SELECT orioledb_tbl_structure('o_test_1'::regclass,
												  'nue');

val_1|val_2
-----+-----
   11|  101
   12|  102
   13|  103
   14|  104
   15|  105
(5 rows)

orioledb_tbl_structure                                                                                                                                                                                                                                                                                                                                                                                                                                                                                                                                                                                                                                                                                                                                                                                                                                                                                                                                                                                                                                                                                                                               
-----------------------------------------------------------------------------------------------------------------------------------------------------------------------------------------------------------------------------------------------------------------------------------------------------------------------------------------------------------------------------------------------------------------------------------------------------------------------------------------------------------------------------------------------------------------------------------------------------------------------------------------------------------------------------------------------------------------------------------------------------------------------------------------------------------------------------------------------------------------------------------------------------------------------------------------------------------------------------------------------------------------------------------------------------------------------------------------------------------------------------------------------------
Index o_test_1_pkey contents
Page 0: level = 0, maxKeyLen = 8, nVacatedBytes = 120
state = free, datoid equal, relnode equal, ix_type = primary, dirty
    Leftmost, Rightmost
  Chunk 0: offset = 0, location = 256, hikey location = 64
    Item 0: mode = update, deleted, undoLocation = 4, offset = 280, tuple = ('1', '101')
      Undo item: 
    Item 1: mode = update, deleted, undoLocation = 0, offset = 304, tuple = ('2', '102')
      Undo item: 
    Item 2: mode = update, deleted, undoLocation = 1, offset = 328, tuple = ('3', '103')
      Undo item: 
    Item 3: mode = update, deleted, undoLocation = 2, offset = 352, tuple = ('4', '104')
      Undo item: 
    Item 4: mode = update, deleted, undoLocation = 3, offset = 376, tuple = ('5', '105')
      Undo item: 
    Item 5: mode = update, offset = 400, tuple = ('11', '101')
    Item 6: mode = update, offset = 424, tuple = ('12', '102')
    Item 7: mode = update, offset = 448, tuple = ('13', '103')
    Item 8: mode = update, offset = 472, tuple = ('14', '104')
    Item 9: mode = update, offset = 496, tuple = ('15', '105')

Index toast: not loaded

(1 row)

step select_2: 
					SELECT * FROM o_test_1 ORDER BY val_1;
					SELECT orioledb_tbl_structure('o_test_1'::regclass,
												  'nue');

val_1|val_2
-----+-----
    1|  101
    2|  102
    3|  103
    4|  104
    5|  105
(5 rows)

orioledb_tbl_structure                                                                                                                                                                                                                                                                                                                                                                                                                                                                                                                                                                                                                                                                                                                                                                                                                                                                                                                                                                                                                                                                                                                               
-----------------------------------------------------------------------------------------------------------------------------------------------------------------------------------------------------------------------------------------------------------------------------------------------------------------------------------------------------------------------------------------------------------------------------------------------------------------------------------------------------------------------------------------------------------------------------------------------------------------------------------------------------------------------------------------------------------------------------------------------------------------------------------------------------------------------------------------------------------------------------------------------------------------------------------------------------------------------------------------------------------------------------------------------------------------------------------------------------------------------------------------------------
Index o_test_1_pkey contents
Page 0: level = 0, maxKeyLen = 8, nVacatedBytes = 120
state = free, datoid equal, relnode equal, ix_type = primary, dirty
    Leftmost, Rightmost
  Chunk 0: offset = 0, location = 256, hikey location = 64
    Item 0: mode = update, deleted, undoLocation = 4, offset = 280, tuple = ('1', '101')
      Undo item: 
    Item 1: mode = update, deleted, undoLocation = 0, offset = 304, tuple = ('2', '102')
      Undo item: 
    Item 2: mode = update, deleted, undoLocation = 1, offset = 328, tuple = ('3', '103')
      Undo item: 
    Item 3: mode = update, deleted, undoLocation = 2, offset = 352, tuple = ('4', '104')
      Undo item: 
    Item 4: mode = update, deleted, undoLocation = 3, offset = 376, tuple = ('5', '105')
      Undo item: 
    Item 5: mode = update, offset = 400, tuple = ('11', '101')
    Item 6: mode = update, offset = 424, tuple = ('12', '102')
    Item 7: mode = update, offset = 448, tuple = ('13', '103')
    Item 8: mode = update, offset = 472, tuple = ('14', '104')
    Item 9: mode = update, offset = 496, tuple = ('15', '105')

Index toast: not loaded

(1 row)

step update_2_3: UPDATE o_test_1 SET val_2 = val_2 + 20 WHERE val_1 < 4; <waiting ...>
step select_1: 
					SELECT * FROM o_test_1 ORDER BY val_1;
					SELECT orioledb_tbl_structure('o_test_1'::regclass,
												  'nue');

val_1|val_2
-----+-----
   11|  101
   12|  102
   13|  103
   14|  104
   15|  105
(5 rows)

orioledb_tbl_structure                                                                                                                                                                                                                                                                                                                                                                                                                                                                                                                                                                                                                                                                                                                                                                                                                                                                                                                                                                                                                                                                                                                               
-----------------------------------------------------------------------------------------------------------------------------------------------------------------------------------------------------------------------------------------------------------------------------------------------------------------------------------------------------------------------------------------------------------------------------------------------------------------------------------------------------------------------------------------------------------------------------------------------------------------------------------------------------------------------------------------------------------------------------------------------------------------------------------------------------------------------------------------------------------------------------------------------------------------------------------------------------------------------------------------------------------------------------------------------------------------------------------------------------------------------------------------------------
Index o_test_1_pkey contents
Page 0: level = 0, maxKeyLen = 8, nVacatedBytes = 120
state = free, datoid equal, relnode equal, ix_type = primary, dirty
    Leftmost, Rightmost
  Chunk 0: offset = 0, location = 256, hikey location = 64
    Item 0: mode = update, deleted, undoLocation = 4, offset = 280, tuple = ('1', '101')
      Undo item: 
    Item 1: mode = update, deleted, undoLocation = 0, offset = 304, tuple = ('2', '102')
      Undo item: 
    Item 2: mode = update, deleted, undoLocation = 1, offset = 328, tuple = ('3', '103')
      Undo item: 
    Item 3: mode = update, deleted, undoLocation = 2, offset = 352, tuple = ('4', '104')
      Undo item: 
    Item 4: mode = update, deleted, undoLocation = 3, offset = 376, tuple = ('5', '105')
      Undo item: 
    Item 5: mode = update, offset = 400, tuple = ('11', '101')
    Item 6: mode = update, offset = 424, tuple = ('12', '102')
    Item 7: mode = update, offset = 448, tuple = ('13', '103')
    Item 8: mode = update, offset = 472, tuple = ('14', '104')
    Item 9: mode = update, offset = 496, tuple = ('15', '105')

Index toast: not loaded

(1 row)

step commit_1: COMMIT;
step update_2_3: <... completed>
step select_1: 
					SELECT * FROM o_test_1 ORDER BY val_1;
					SELECT orioledb_tbl_structure('o_test_1'::regclass,
												  'nue');

val_1|val_2
-----+-----
   11|  101
   12|  102
   13|  103
   14|  104
   15|  105
(5 rows)

orioledb_tbl_structure                                                                                                                                                                                                                                                                                                                                                                                                                                                                                                                                                                                                                                                                                                                                                                                     
-----------------------------------------------------------------------------------------------------------------------------------------------------------------------------------------------------------------------------------------------------------------------------------------------------------------------------------------------------------------------------------------------------------------------------------------------------------------------------------------------------------------------------------------------------------------------------------------------------------------------------------------------------------------------------------------------------------------------------------------------------------------------------------------------------------
Index o_test_1_pkey contents
Page 0: level = 0, maxKeyLen = 8, nVacatedBytes = 120
state = free, datoid equal, relnode equal, ix_type = primary, dirty
    Leftmost, Rightmost
  Chunk 0: offset = 0, location = 256, hikey location = 64
    Item 0: deleted, offset = 280, tuple = ('1', '101')
    Item 1: deleted, offset = 304, tuple = ('2', '102')
    Item 2: deleted, offset = 328, tuple = ('3', '103')
    Item 3: deleted, offset = 352, tuple = ('4', '104')
    Item 4: deleted, offset = 376, tuple = ('5', '105')
    Item 5: offset = 400, tuple = ('11', '101')
    Item 6: offset = 424, tuple = ('12', '102')
    Item 7: offset = 448, tuple = ('13', '103')
    Item 8: offset = 472, tuple = ('14', '104')
    Item 9: offset = 496, tuple = ('15', '105')

Index toast: not loaded

(1 row)

step select_2: 
					SELECT * FROM o_test_1 ORDER BY val_1;
					SELECT orioledb_tbl_structure('o_test_1'::regclass,
												  'nue');

val_1|val_2
-----+-----
   11|  101
   12|  102
   13|  103
   14|  104
   15|  105
(5 rows)

orioledb_tbl_structure                                                                                                                                                                                                                                                                                                                                                                                                                                                                                                                                                                                                                                                                                                                                                                                     
-----------------------------------------------------------------------------------------------------------------------------------------------------------------------------------------------------------------------------------------------------------------------------------------------------------------------------------------------------------------------------------------------------------------------------------------------------------------------------------------------------------------------------------------------------------------------------------------------------------------------------------------------------------------------------------------------------------------------------------------------------------------------------------------------------------
Index o_test_1_pkey contents
Page 0: level = 0, maxKeyLen = 8, nVacatedBytes = 120
state = free, datoid equal, relnode equal, ix_type = primary, dirty
    Leftmost, Rightmost
  Chunk 0: offset = 0, location = 256, hikey location = 64
    Item 0: deleted, offset = 280, tuple = ('1', '101')
    Item 1: deleted, offset = 304, tuple = ('2', '102')
    Item 2: deleted, offset = 328, tuple = ('3', '103')
    Item 3: deleted, offset = 352, tuple = ('4', '104')
    Item 4: deleted, offset = 376, tuple = ('5', '105')
    Item 5: offset = 400, tuple = ('11', '101')
    Item 6: offset = 424, tuple = ('12', '102')
    Item 7: offset = 448, tuple = ('13', '103')
    Item 8: offset = 472, tuple = ('14', '104')
    Item 9: offset = 496, tuple = ('15', '105')

Index toast: not loaded

(1 row)

step commit_2: COMMIT;
step select_1: 
					SELECT * FROM o_test_1 ORDER BY val_1;
					SELECT orioledb_tbl_structure('o_test_1'::regclass,
												  'nue');

val_1|val_2
-----+-----
   11|  101
   12|  102
   13|  103
   14|  104
   15|  105
(5 rows)

orioledb_tbl_structure                                                                                                                                                                                                                                                                                                                                                                                                                                                                                                                                                                                                                                                                                                                                                                                     
-----------------------------------------------------------------------------------------------------------------------------------------------------------------------------------------------------------------------------------------------------------------------------------------------------------------------------------------------------------------------------------------------------------------------------------------------------------------------------------------------------------------------------------------------------------------------------------------------------------------------------------------------------------------------------------------------------------------------------------------------------------------------------------------------------------
Index o_test_1_pkey contents
Page 0: level = 0, maxKeyLen = 8, nVacatedBytes = 120
state = free, datoid equal, relnode equal, ix_type = primary, dirty
    Leftmost, Rightmost
  Chunk 0: offset = 0, location = 256, hikey location = 64
    Item 0: deleted, offset = 280, tuple = ('1', '101')
    Item 1: deleted, offset = 304, tuple = ('2', '102')
    Item 2: deleted, offset = 328, tuple = ('3', '103')
    Item 3: deleted, offset = 352, tuple = ('4', '104')
    Item 4: deleted, offset = 376, tuple = ('5', '105')
    Item 5: offset = 400, tuple = ('11', '101')
    Item 6: offset = 424, tuple = ('12', '102')
    Item 7: offset = 448, tuple = ('13', '103')
    Item 8: offset = 472, tuple = ('14', '104')
    Item 9: offset = 496, tuple = ('15', '105')

Index toast: not loaded

(1 row)

step select_2: 
					SELECT * FROM o_test_1 ORDER BY val_1;
					SELECT orioledb_tbl_structure('o_test_1'::regclass,
												  'nue');

val_1|val_2
-----+-----
   11|  101
   12|  102
   13|  103
   14|  104
   15|  105
(5 rows)

orioledb_tbl_structure                                                                                                                                                                                                                                                                                                                                                                                                                                                                                                                                                                                                                                                                                                                                                                                     
-----------------------------------------------------------------------------------------------------------------------------------------------------------------------------------------------------------------------------------------------------------------------------------------------------------------------------------------------------------------------------------------------------------------------------------------------------------------------------------------------------------------------------------------------------------------------------------------------------------------------------------------------------------------------------------------------------------------------------------------------------------------------------------------------------------
Index o_test_1_pkey contents
Page 0: level = 0, maxKeyLen = 8, nVacatedBytes = 120
state = free, datoid equal, relnode equal, ix_type = primary, dirty
    Leftmost, Rightmost
  Chunk 0: offset = 0, location = 256, hikey location = 64
    Item 0: deleted, offset = 280, tuple = ('1', '101')
    Item 1: deleted, offset = 304, tuple = ('2', '102')
    Item 2: deleted, offset = 328, tuple = ('3', '103')
    Item 3: deleted, offset = 352, tuple = ('4', '104')
    Item 4: deleted, offset = 376, tuple = ('5', '105')
    Item 5: offset = 400, tuple = ('11', '101')
    Item 6: offset = 424, tuple = ('12', '102')
    Item 7: offset = 448, tuple = ('13', '103')
    Item 8: offset = 472, tuple = ('14', '104')
    Item 9: offset = 496, tuple = ('15', '105')

Index toast: not loaded

(1 row)


starting permutation: insert_1 select_1 begin_1 begin_2 select_1 update_1_4 select_1 select_2 update_2_5 select_1 commit_1 select_1 select_2 commit_2 select_1 select_2
step insert_1: INSERT INTO o_test_1 VALUES (100, 1), (200, 2);
step select_1: 
					SELECT * FROM o_test_1 ORDER BY val_1;
					SELECT orioledb_tbl_structure('o_test_1'::regclass,
												  'nue');

val_1|val_2
-----+-----
    1|  101
    2|  102
    3|  103
    4|  104
    5|  105
  100|    1
  200|    2
(7 rows)

orioledb_tbl_structure                                                                                                                                                                                                                                                                                                                                                                                                                                                                                                                                                                                    
----------------------------------------------------------------------------------------------------------------------------------------------------------------------------------------------------------------------------------------------------------------------------------------------------------------------------------------------------------------------------------------------------------------------------------------------------------------------------------------------------------------------------------------------------------------------------------------------------------
Index o_test_1_pkey contents
Page 0: level = 0, maxKeyLen = 8, nVacatedBytes = 0
state = free, datoid equal, relnode equal, ix_type = primary, dirty
    Leftmost, Rightmost
  Chunk 0: offset = 0, location = 256, hikey location = 64
    Item 0: offset = 272, tuple = ('1', '101')
    Item 1: offset = 296, tuple = ('2', '102')
    Item 2: offset = 320, tuple = ('3', '103')
    Item 3: offset = 344, tuple = ('4', '104')
    Item 4: offset = 368, tuple = ('5', '105')
    Item 5: offset = 392, tuple = ('100', '1')
    Item 6: offset = 416, tuple = ('200', '2')

Index toast: not loaded

(1 row)

step begin_1: BEGIN;
step begin_2: BEGIN;
step select_1: 
					SELECT * FROM o_test_1 ORDER BY val_1;
					SELECT orioledb_tbl_structure('o_test_1'::regclass,
												  'nue');

val_1|val_2
-----+-----
    1|  101
    2|  102
    3|  103
    4|  104
    5|  105
  100|    1
  200|    2
(7 rows)

orioledb_tbl_structure                                                                                                                                                                                                                                                                                                                                                                                                                                                                                                                                                                                    
----------------------------------------------------------------------------------------------------------------------------------------------------------------------------------------------------------------------------------------------------------------------------------------------------------------------------------------------------------------------------------------------------------------------------------------------------------------------------------------------------------------------------------------------------------------------------------------------------------
Index o_test_1_pkey contents
Page 0: level = 0, maxKeyLen = 8, nVacatedBytes = 0
state = free, datoid equal, relnode equal, ix_type = primary, dirty
    Leftmost, Rightmost
  Chunk 0: offset = 0, location = 256, hikey location = 64
    Item 0: offset = 272, tuple = ('1', '101')
    Item 1: offset = 296, tuple = ('2', '102')
    Item 2: offset = 320, tuple = ('3', '103')
    Item 3: offset = 344, tuple = ('4', '104')
    Item 4: offset = 368, tuple = ('5', '105')
    Item 5: offset = 392, tuple = ('100', '1')
    Item 6: offset = 416, tuple = ('200', '2')

Index toast: not loaded

(1 row)

step update_1_4: 
	UPDATE o_test_1 SET val_1 = val_1 + 10 WHERE val_1 < 4;
	UPDATE o_test_1 SET val_1 = val_1 - 10 WHERE val_1 = 4;

step select_1: 
					SELECT * FROM o_test_1 ORDER BY val_1;
					SELECT orioledb_tbl_structure('o_test_1'::regclass,
												  'nue');

val_1|val_2
-----+-----
   -6|  104
    5|  105
   11|  101
   12|  102
   13|  103
  100|    1
  200|    2
(7 rows)

orioledb_tbl_structure                                                                                                                                                                                                                                                                                                                                                                                                                                                                                                                                                                                                                                                                                                                                                                                                                                                                                                                                                                                                                                                                                                  
------------------------------------------------------------------------------------------------------------------------------------------------------------------------------------------------------------------------------------------------------------------------------------------------------------------------------------------------------------------------------------------------------------------------------------------------------------------------------------------------------------------------------------------------------------------------------------------------------------------------------------------------------------------------------------------------------------------------------------------------------------------------------------------------------------------------------------------------------------------------------------------------------------------------------------------------------------------------------------------------------------------------------------------------------------------------------------------------------------------------
Index o_test_1_pkey contents
Page 0: level = 0, maxKeyLen = 8, nVacatedBytes = 96
state = free, datoid equal, relnode equal, ix_type = primary, dirty
    Leftmost, Rightmost
  Chunk 0: offset = 0, location = 256, hikey location = 64
    Item 0: mode = update, offset = 280, tuple = ('-6', '104')
    Item 1: mode = update, deleted, undoLocation = 3, offset = 304, tuple = ('1', '101')
      Undo item: 
    Item 2: mode = update, deleted, undoLocation = 0, offset = 328, tuple = ('2', '102')
      Undo item: 
    Item 3: mode = update, deleted, undoLocation = 1, offset = 352, tuple = ('3', '103')
      Undo item: 
    Item 4: mode = update, deleted, undoLocation = 2, offset = 376, tuple = ('4', '104')
      Undo item: 
    Item 5: offset = 400, tuple = ('5', '105')
    Item 6: mode = update, offset = 424, tuple = ('11', '101')
    Item 7: mode = update, offset = 448, tuple = ('12', '102')
    Item 8: mode = update, offset = 472, tuple = ('13', '103')
    Item 9: offset = 496, tuple = ('100', '1')
    Item 10: offset = 520, tuple = ('200', '2')

Index toast: not loaded

(1 row)

step select_2: 
					SELECT * FROM o_test_1 ORDER BY val_1;
					SELECT orioledb_tbl_structure('o_test_1'::regclass,
												  'nue');

val_1|val_2
-----+-----
    1|  101
    2|  102
    3|  103
    4|  104
    5|  105
  100|    1
  200|    2
(7 rows)

orioledb_tbl_structure                                                                                                                                                                                                                                                                                                                                                                                                                                                                                                                                                                                                                                                                                                                                                                                                                                                                                                                                                                                                                                                                                                  
------------------------------------------------------------------------------------------------------------------------------------------------------------------------------------------------------------------------------------------------------------------------------------------------------------------------------------------------------------------------------------------------------------------------------------------------------------------------------------------------------------------------------------------------------------------------------------------------------------------------------------------------------------------------------------------------------------------------------------------------------------------------------------------------------------------------------------------------------------------------------------------------------------------------------------------------------------------------------------------------------------------------------------------------------------------------------------------------------------------------
Index o_test_1_pkey contents
Page 0: level = 0, maxKeyLen = 8, nVacatedBytes = 96
state = free, datoid equal, relnode equal, ix_type = primary, dirty
    Leftmost, Rightmost
  Chunk 0: offset = 0, location = 256, hikey location = 64
    Item 0: mode = update, offset = 280, tuple = ('-6', '104')
    Item 1: mode = update, deleted, undoLocation = 3, offset = 304, tuple = ('1', '101')
      Undo item: 
    Item 2: mode = update, deleted, undoLocation = 0, offset = 328, tuple = ('2', '102')
      Undo item: 
    Item 3: mode = update, deleted, undoLocation = 1, offset = 352, tuple = ('3', '103')
      Undo item: 
    Item 4: mode = update, deleted, undoLocation = 2, offset = 376, tuple = ('4', '104')
      Undo item: 
    Item 5: offset = 400, tuple = ('5', '105')
    Item 6: mode = update, offset = 424, tuple = ('11', '101')
    Item 7: mode = update, offset = 448, tuple = ('12', '102')
    Item 8: mode = update, offset = 472, tuple = ('13', '103')
    Item 9: offset = 496, tuple = ('100', '1')
    Item 10: offset = 520, tuple = ('200', '2')

Index toast: not loaded

(1 row)

step update_2_5: UPDATE o_test_1 SET val_2 = val_2 + 20 WHERE val_1 > 10;
step select_1: 
					SELECT * FROM o_test_1 ORDER BY val_1;
					SELECT orioledb_tbl_structure('o_test_1'::regclass,
												  'nue');

val_1|val_2
-----+-----
   -6|  104
    5|  105
   11|  101
   12|  102
   13|  103
  100|    1
  200|    2
(7 rows)

orioledb_tbl_structure                                                                                                                                                                                                                                                                                                                                                                                                                                                                                                                                                                                                                                                                                                                                                                                                                                                                                                                                                                                                                                                                                                                                                                                                                                                            
----------------------------------------------------------------------------------------------------------------------------------------------------------------------------------------------------------------------------------------------------------------------------------------------------------------------------------------------------------------------------------------------------------------------------------------------------------------------------------------------------------------------------------------------------------------------------------------------------------------------------------------------------------------------------------------------------------------------------------------------------------------------------------------------------------------------------------------------------------------------------------------------------------------------------------------------------------------------------------------------------------------------------------------------------------------------------------------------------------------------------------------------------------------------------------------------------------------------------------------------------------------------------------
Index o_test_1_pkey contents
Page 0: level = 0, maxKeyLen = 8, nVacatedBytes = 96
state = free, datoid equal, relnode equal, ix_type = primary, dirty
    Leftmost, Rightmost
  Chunk 0: offset = 0, location = 256, hikey location = 64
    Item 0: mode = update, offset = 280, tuple = ('-6', '104')
    Item 1: mode = update, deleted, undoLocation = 5, offset = 304, tuple = ('1', '101')
      Undo item: 
    Item 2: mode = update, deleted, undoLocation = 0, offset = 328, tuple = ('2', '102')
      Undo item: 
    Item 3: mode = update, deleted, undoLocation = 1, offset = 352, tuple = ('3', '103')
      Undo item: 
    Item 4: mode = update, deleted, undoLocation = 2, offset = 376, tuple = ('4', '104')
      Undo item: 
    Item 5: offset = 400, tuple = ('5', '105')
    Item 6: mode = update, offset = 424, tuple = ('11', '101')
    Item 7: mode = update, offset = 448, tuple = ('12', '102')
    Item 8: mode = update, offset = 472, tuple = ('13', '103')
    Item 9: mode = noKeyUpdate, undoLocation = 3, offset = 496, tuple = ('100', '21')
      Undo item: tuple = ('100', '1')
    Item 10: mode = noKeyUpdate, undoLocation = 4, offset = 520, tuple = ('200', '22')
      Undo item: tuple = ('200', '2')

Index toast: not loaded

(1 row)

step commit_1: COMMIT;
step select_1: 
					SELECT * FROM o_test_1 ORDER BY val_1;
					SELECT orioledb_tbl_structure('o_test_1'::regclass,
												  'nue');

val_1|val_2
-----+-----
   -6|  104
    5|  105
   11|  101
   12|  102
   13|  103
  100|    1
  200|    2
(7 rows)

orioledb_tbl_structure                                                                                                                                                                                                                                                                                                                                                                                                                                                                                                                                                                                                                                                                                                                                                                                                                                                                                                                                                                                    
----------------------------------------------------------------------------------------------------------------------------------------------------------------------------------------------------------------------------------------------------------------------------------------------------------------------------------------------------------------------------------------------------------------------------------------------------------------------------------------------------------------------------------------------------------------------------------------------------------------------------------------------------------------------------------------------------------------------------------------------------------------------------------------------------------------------------------------------------------------------------------------------------------------------------------------------------------------------------------------------------------
Index o_test_1_pkey contents
Page 0: level = 0, maxKeyLen = 8, nVacatedBytes = 96
state = free, datoid equal, relnode equal, ix_type = primary, dirty
    Leftmost, Rightmost
  Chunk 0: offset = 0, location = 256, hikey location = 64
    Item 0: offset = 280, tuple = ('-6', '104')
    Item 1: deleted, offset = 304, tuple = ('1', '101')
    Item 2: deleted, offset = 328, tuple = ('2', '102')
    Item 3: deleted, offset = 352, tuple = ('3', '103')
    Item 4: deleted, offset = 376, tuple = ('4', '104')
    Item 5: offset = 400, tuple = ('5', '105')
    Item 6: offset = 424, tuple = ('11', '101')
    Item 7: offset = 448, tuple = ('12', '102')
    Item 8: offset = 472, tuple = ('13', '103')
    Item 9: mode = noKeyUpdate, undoLocation = 1, offset = 496, tuple = ('100', '21')
      Undo item: tuple = ('100', '1')
    Item 10: mode = noKeyUpdate, undoLocation = 0, offset = 520, tuple = ('200', '22')
      Undo item: tuple = ('200', '2')

Index toast: not loaded

(1 row)

step select_2: 
					SELECT * FROM o_test_1 ORDER BY val_1;
					SELECT orioledb_tbl_structure('o_test_1'::regclass,
												  'nue');

val_1|val_2
-----+-----
   -6|  104
    5|  105
   11|  101
   12|  102
   13|  103
  100|   21
  200|   22
(7 rows)

orioledb_tbl_structure                                                                                                                                                                                                                                                                                                                                                                                                                                                                                                                                                                                                                                                                                                                                                                                                                                                                                                                                                                                    
----------------------------------------------------------------------------------------------------------------------------------------------------------------------------------------------------------------------------------------------------------------------------------------------------------------------------------------------------------------------------------------------------------------------------------------------------------------------------------------------------------------------------------------------------------------------------------------------------------------------------------------------------------------------------------------------------------------------------------------------------------------------------------------------------------------------------------------------------------------------------------------------------------------------------------------------------------------------------------------------------------
Index o_test_1_pkey contents
Page 0: level = 0, maxKeyLen = 8, nVacatedBytes = 96
state = free, datoid equal, relnode equal, ix_type = primary, dirty
    Leftmost, Rightmost
  Chunk 0: offset = 0, location = 256, hikey location = 64
    Item 0: offset = 280, tuple = ('-6', '104')
    Item 1: deleted, offset = 304, tuple = ('1', '101')
    Item 2: deleted, offset = 328, tuple = ('2', '102')
    Item 3: deleted, offset = 352, tuple = ('3', '103')
    Item 4: deleted, offset = 376, tuple = ('4', '104')
    Item 5: offset = 400, tuple = ('5', '105')
    Item 6: offset = 424, tuple = ('11', '101')
    Item 7: offset = 448, tuple = ('12', '102')
    Item 8: offset = 472, tuple = ('13', '103')
    Item 9: mode = noKeyUpdate, undoLocation = 1, offset = 496, tuple = ('100', '21')
      Undo item: tuple = ('100', '1')
    Item 10: mode = noKeyUpdate, undoLocation = 0, offset = 520, tuple = ('200', '22')
      Undo item: tuple = ('200', '2')

Index toast: not loaded

(1 row)

step commit_2: COMMIT;
step select_1: 
					SELECT * FROM o_test_1 ORDER BY val_1;
					SELECT orioledb_tbl_structure('o_test_1'::regclass,
												  'nue');

val_1|val_2
-----+-----
   -6|  104
    5|  105
   11|  101
   12|  102
   13|  103
  100|   21
  200|   22
(7 rows)

orioledb_tbl_structure                                                                                                                                                                                                                                                                                                                                                                                                                                                                                                                                                                                                                                                                                                                                                                                                                            
--------------------------------------------------------------------------------------------------------------------------------------------------------------------------------------------------------------------------------------------------------------------------------------------------------------------------------------------------------------------------------------------------------------------------------------------------------------------------------------------------------------------------------------------------------------------------------------------------------------------------------------------------------------------------------------------------------------------------------------------------------------------------------------------------------------------------------------------------
Index o_test_1_pkey contents
Page 0: level = 0, maxKeyLen = 8, nVacatedBytes = 96
state = free, datoid equal, relnode equal, ix_type = primary, dirty
    Leftmost, Rightmost
  Chunk 0: offset = 0, location = 256, hikey location = 64
    Item 0: offset = 280, tuple = ('-6', '104')
    Item 1: deleted, offset = 304, tuple = ('1', '101')
    Item 2: deleted, offset = 328, tuple = ('2', '102')
    Item 3: deleted, offset = 352, tuple = ('3', '103')
    Item 4: deleted, offset = 376, tuple = ('4', '104')
    Item 5: offset = 400, tuple = ('5', '105')
    Item 6: offset = 424, tuple = ('11', '101')
    Item 7: offset = 448, tuple = ('12', '102')
    Item 8: offset = 472, tuple = ('13', '103')
    Item 9: offset = 496, tuple = ('100', '21')
    Item 10: offset = 520, tuple = ('200', '22')

Index toast: not loaded

(1 row)

step select_2: 
					SELECT * FROM o_test_1 ORDER BY val_1;
					SELECT orioledb_tbl_structure('o_test_1'::regclass,
												  'nue');

val_1|val_2
-----+-----
   -6|  104
    5|  105
   11|  101
   12|  102
   13|  103
  100|   21
  200|   22
(7 rows)

orioledb_tbl_structure                                                                                                                                                                                                                                                                                                                                                                                                                                                                                                                                                                                                                                                                                                                                                                                                                            
--------------------------------------------------------------------------------------------------------------------------------------------------------------------------------------------------------------------------------------------------------------------------------------------------------------------------------------------------------------------------------------------------------------------------------------------------------------------------------------------------------------------------------------------------------------------------------------------------------------------------------------------------------------------------------------------------------------------------------------------------------------------------------------------------------------------------------------------------
Index o_test_1_pkey contents
Page 0: level = 0, maxKeyLen = 8, nVacatedBytes = 96
state = free, datoid equal, relnode equal, ix_type = primary, dirty
    Leftmost, Rightmost
  Chunk 0: offset = 0, location = 256, hikey location = 64
    Item 0: offset = 280, tuple = ('-6', '104')
    Item 1: deleted, offset = 304, tuple = ('1', '101')
    Item 2: deleted, offset = 328, tuple = ('2', '102')
    Item 3: deleted, offset = 352, tuple = ('3', '103')
    Item 4: deleted, offset = 376, tuple = ('4', '104')
    Item 5: offset = 400, tuple = ('5', '105')
    Item 6: offset = 424, tuple = ('11', '101')
    Item 7: offset = 448, tuple = ('12', '102')
    Item 8: offset = 472, tuple = ('13', '103')
    Item 9: offset = 496, tuple = ('100', '21')
    Item 10: offset = 520, tuple = ('200', '22')

Index toast: not loaded

(1 row)


starting permutation: begin_1 begin_2 select_1 update_1_5 select_1 select_2 insert_1 select_1 select_2 update_2_3 select_1 commit_1 select_1 select_2 commit_2 select_1 select_2
step begin_1: BEGIN;
step begin_2: BEGIN;
step select_1: 
					SELECT * FROM o_test_1 ORDER BY val_1;
					SELECT orioledb_tbl_structure('o_test_1'::regclass,
												  'nue');

val_1|val_2
-----+-----
    1|  101
    2|  102
    3|  103
    4|  104
    5|  105
(5 rows)

orioledb_tbl_structure                                                                                                                                                                                                                                                                                                                                                                                                                                                                                      
------------------------------------------------------------------------------------------------------------------------------------------------------------------------------------------------------------------------------------------------------------------------------------------------------------------------------------------------------------------------------------------------------------------------------------------------------------------------------------------------------------
Index o_test_1_pkey contents
Page 0: level = 0, maxKeyLen = 8, nVacatedBytes = 0
state = free, datoid equal, relnode equal, ix_type = primary, dirty
    Leftmost, Rightmost
  Chunk 0: offset = 0, location = 256, hikey location = 64
    Item 0: offset = 272, tuple = ('1', '101')
    Item 1: offset = 296, tuple = ('2', '102')
    Item 2: offset = 320, tuple = ('3', '103')
    Item 3: offset = 344, tuple = ('4', '104')
    Item 4: offset = 368, tuple = ('5', '105')

Index toast: not loaded

(1 row)

step update_1_5: UPDATE o_test_1 SET val_2 = val_2 + 10;
step select_1: 
					SELECT * FROM o_test_1 ORDER BY val_1;
					SELECT orioledb_tbl_structure('o_test_1'::regclass,
												  'nue');

val_1|val_2
-----+-----
    1|  111
    2|  112
    3|  113
    4|  114
    5|  115
(5 rows)

orioledb_tbl_structure                                                                                                                                                                                                                                                                                                                                                                                                                                                                                                                                                                                                                                                                                                                                                                                                                                                                                  
--------------------------------------------------------------------------------------------------------------------------------------------------------------------------------------------------------------------------------------------------------------------------------------------------------------------------------------------------------------------------------------------------------------------------------------------------------------------------------------------------------------------------------------------------------------------------------------------------------------------------------------------------------------------------------------------------------------------------------------------------------------------------------------------------------------------------------------------------------------------------------------------------------
Index o_test_1_pkey contents
Page 0: level = 0, maxKeyLen = 8, nVacatedBytes = 0
state = free, datoid equal, relnode equal, ix_type = primary, dirty
    Leftmost, Rightmost
  Chunk 0: offset = 0, location = 256, hikey location = 64
    Item 0: mode = noKeyUpdate, undoLocation = 4, offset = 272, tuple = ('1', '111')
      Undo item: tuple = ('1', '101')
    Item 1: mode = noKeyUpdate, undoLocation = 0, offset = 296, tuple = ('2', '112')
      Undo item: tuple = ('2', '102')
    Item 2: mode = noKeyUpdate, undoLocation = 1, offset = 320, tuple = ('3', '113')
      Undo item: tuple = ('3', '103')
    Item 3: mode = noKeyUpdate, undoLocation = 2, offset = 344, tuple = ('4', '114')
      Undo item: tuple = ('4', '104')
    Item 4: mode = noKeyUpdate, undoLocation = 3, offset = 368, tuple = ('5', '115')
      Undo item: tuple = ('5', '105')

Index toast: not loaded

(1 row)

step select_2: 
					SELECT * FROM o_test_1 ORDER BY val_1;
					SELECT orioledb_tbl_structure('o_test_1'::regclass,
												  'nue');

val_1|val_2
-----+-----
    1|  101
    2|  102
    3|  103
    4|  104
    5|  105
(5 rows)

orioledb_tbl_structure                                                                                                                                                                                                                                                                                                                                                                                                                                                                                                                                                                                                                                                                                                                                                                                                                                                                                  
--------------------------------------------------------------------------------------------------------------------------------------------------------------------------------------------------------------------------------------------------------------------------------------------------------------------------------------------------------------------------------------------------------------------------------------------------------------------------------------------------------------------------------------------------------------------------------------------------------------------------------------------------------------------------------------------------------------------------------------------------------------------------------------------------------------------------------------------------------------------------------------------------------
Index o_test_1_pkey contents
Page 0: level = 0, maxKeyLen = 8, nVacatedBytes = 0
state = free, datoid equal, relnode equal, ix_type = primary, dirty
    Leftmost, Rightmost
  Chunk 0: offset = 0, location = 256, hikey location = 64
    Item 0: mode = noKeyUpdate, undoLocation = 4, offset = 272, tuple = ('1', '111')
      Undo item: tuple = ('1', '101')
    Item 1: mode = noKeyUpdate, undoLocation = 0, offset = 296, tuple = ('2', '112')
      Undo item: tuple = ('2', '102')
    Item 2: mode = noKeyUpdate, undoLocation = 1, offset = 320, tuple = ('3', '113')
      Undo item: tuple = ('3', '103')
    Item 3: mode = noKeyUpdate, undoLocation = 2, offset = 344, tuple = ('4', '114')
      Undo item: tuple = ('4', '104')
    Item 4: mode = noKeyUpdate, undoLocation = 3, offset = 368, tuple = ('5', '115')
      Undo item: tuple = ('5', '105')

Index toast: not loaded

(1 row)

step insert_1: INSERT INTO o_test_1 VALUES (100, 1), (200, 2);
step select_1: 
					SELECT * FROM o_test_1 ORDER BY val_1;
					SELECT orioledb_tbl_structure('o_test_1'::regclass,
												  'nue');

val_1|val_2
-----+-----
    1|  111
    2|  112
    3|  113
    4|  114
    5|  115
  100|    1
  200|    2
(7 rows)

orioledb_tbl_structure                                                                                                                                                                                                                                                                                                                                                                                                                                                                                                                                                                                                                                                                                                                                                                                                                                                                                                                                                                                                              
------------------------------------------------------------------------------------------------------------------------------------------------------------------------------------------------------------------------------------------------------------------------------------------------------------------------------------------------------------------------------------------------------------------------------------------------------------------------------------------------------------------------------------------------------------------------------------------------------------------------------------------------------------------------------------------------------------------------------------------------------------------------------------------------------------------------------------------------------------------------------------------------------------------------------------------------------------------------------------------------------------------------------------
Index o_test_1_pkey contents
Page 0: level = 0, maxKeyLen = 8, nVacatedBytes = 0
state = free, datoid equal, relnode equal, ix_type = primary, dirty
    Leftmost, Rightmost
  Chunk 0: offset = 0, location = 256, hikey location = 64
    Item 0: mode = noKeyUpdate, undoLocation = 4, offset = 272, tuple = ('1', '111')
      Undo item: tuple = ('1', '101')
    Item 1: mode = noKeyUpdate, undoLocation = 0, offset = 296, tuple = ('2', '112')
      Undo item: tuple = ('2', '102')
    Item 2: mode = noKeyUpdate, undoLocation = 1, offset = 320, tuple = ('3', '113')
      Undo item: tuple = ('3', '103')
    Item 3: mode = noKeyUpdate, undoLocation = 2, offset = 344, tuple = ('4', '114')
      Undo item: tuple = ('4', '104')
    Item 4: mode = noKeyUpdate, undoLocation = 3, offset = 368, tuple = ('5', '115')
      Undo item: tuple = ('5', '105')
    Item 5: mode = update, offset = 392, tuple = ('100', '1')
    Item 6: mode = update, offset = 416, tuple = ('200', '2')

Index toast: not loaded

(1 row)

step select_2: 
					SELECT * FROM o_test_1 ORDER BY val_1;
					SELECT orioledb_tbl_structure('o_test_1'::regclass,
												  'nue');

val_1|val_2
-----+-----
    1|  101
    2|  102
    3|  103
    4|  104
    5|  105
(5 rows)

orioledb_tbl_structure                                                                                                                                                                                                                                                                                                                                                                                                                                                                                                                                                                                                                                                                                                                                                                                                                                                                                                                                                                                                              
------------------------------------------------------------------------------------------------------------------------------------------------------------------------------------------------------------------------------------------------------------------------------------------------------------------------------------------------------------------------------------------------------------------------------------------------------------------------------------------------------------------------------------------------------------------------------------------------------------------------------------------------------------------------------------------------------------------------------------------------------------------------------------------------------------------------------------------------------------------------------------------------------------------------------------------------------------------------------------------------------------------------------------
Index o_test_1_pkey contents
Page 0: level = 0, maxKeyLen = 8, nVacatedBytes = 0
state = free, datoid equal, relnode equal, ix_type = primary, dirty
    Leftmost, Rightmost
  Chunk 0: offset = 0, location = 256, hikey location = 64
    Item 0: mode = noKeyUpdate, undoLocation = 4, offset = 272, tuple = ('1', '111')
      Undo item: tuple = ('1', '101')
    Item 1: mode = noKeyUpdate, undoLocation = 0, offset = 296, tuple = ('2', '112')
      Undo item: tuple = ('2', '102')
    Item 2: mode = noKeyUpdate, undoLocation = 1, offset = 320, tuple = ('3', '113')
      Undo item: tuple = ('3', '103')
    Item 3: mode = noKeyUpdate, undoLocation = 2, offset = 344, tuple = ('4', '114')
      Undo item: tuple = ('4', '104')
    Item 4: mode = noKeyUpdate, undoLocation = 3, offset = 368, tuple = ('5', '115')
      Undo item: tuple = ('5', '105')
    Item 5: mode = update, offset = 392, tuple = ('100', '1')
    Item 6: mode = update, offset = 416, tuple = ('200', '2')

Index toast: not loaded

(1 row)

step update_2_3: UPDATE o_test_1 SET val_2 = val_2 + 20 WHERE val_1 < 4; <waiting ...>
step select_1: 
					SELECT * FROM o_test_1 ORDER BY val_1;
					SELECT orioledb_tbl_structure('o_test_1'::regclass,
												  'nue');

val_1|val_2
-----+-----
    1|  111
    2|  112
    3|  113
    4|  114
    5|  115
  100|    1
  200|    2
(7 rows)

orioledb_tbl_structure                                                                                                                                                                                                                                                                                                                                                                                                                                                                                                                                                                                                                                                                                                                                                                                                                                                                                                                                                                                                              
------------------------------------------------------------------------------------------------------------------------------------------------------------------------------------------------------------------------------------------------------------------------------------------------------------------------------------------------------------------------------------------------------------------------------------------------------------------------------------------------------------------------------------------------------------------------------------------------------------------------------------------------------------------------------------------------------------------------------------------------------------------------------------------------------------------------------------------------------------------------------------------------------------------------------------------------------------------------------------------------------------------------------------
Index o_test_1_pkey contents
Page 0: level = 0, maxKeyLen = 8, nVacatedBytes = 0
state = free, datoid equal, relnode equal, ix_type = primary, dirty
    Leftmost, Rightmost
  Chunk 0: offset = 0, location = 256, hikey location = 64
    Item 0: mode = noKeyUpdate, undoLocation = 4, offset = 272, tuple = ('1', '111')
      Undo item: tuple = ('1', '101')
    Item 1: mode = noKeyUpdate, undoLocation = 0, offset = 296, tuple = ('2', '112')
      Undo item: tuple = ('2', '102')
    Item 2: mode = noKeyUpdate, undoLocation = 1, offset = 320, tuple = ('3', '113')
      Undo item: tuple = ('3', '103')
    Item 3: mode = noKeyUpdate, undoLocation = 2, offset = 344, tuple = ('4', '114')
      Undo item: tuple = ('4', '104')
    Item 4: mode = noKeyUpdate, undoLocation = 3, offset = 368, tuple = ('5', '115')
      Undo item: tuple = ('5', '105')
    Item 5: mode = update, offset = 392, tuple = ('100', '1')
    Item 6: mode = update, offset = 416, tuple = ('200', '2')

Index toast: not loaded

(1 row)

step commit_1: COMMIT;
step update_2_3: <... completed>
step select_1: 
					SELECT * FROM o_test_1 ORDER BY val_1;
					SELECT orioledb_tbl_structure('o_test_1'::regclass,
												  'nue');

val_1|val_2
-----+-----
    1|  111
    2|  112
    3|  113
    4|  114
    5|  115
  100|    1
  200|    2
(7 rows)

orioledb_tbl_structure                                                                                                                                                                                                                                                                                                                                                                                                                                                                                                                                                                                                                                                                                                                                                                                                                        
----------------------------------------------------------------------------------------------------------------------------------------------------------------------------------------------------------------------------------------------------------------------------------------------------------------------------------------------------------------------------------------------------------------------------------------------------------------------------------------------------------------------------------------------------------------------------------------------------------------------------------------------------------------------------------------------------------------------------------------------------------------------------------------------------------------------------------------------
Index o_test_1_pkey contents
Page 0: level = 0, maxKeyLen = 8, nVacatedBytes = 0
state = free, datoid equal, relnode equal, ix_type = primary, dirty
    Leftmost, Rightmost
  Chunk 0: offset = 0, location = 256, hikey location = 64
    Item 0: mode = noKeyUpdate, undoLocation = 2, offset = 272, tuple = ('1', '131')
      Undo item: tuple = ('1', '111')
    Item 1: mode = noKeyUpdate, undoLocation = 0, offset = 296, tuple = ('2', '132')
      Undo item: tuple = ('2', '112')
    Item 2: mode = noKeyUpdate, undoLocation = 1, offset = 320, tuple = ('3', '133')
      Undo item: tuple = ('3', '113')
    Item 3: offset = 344, tuple = ('4', '114')
    Item 4: offset = 368, tuple = ('5', '115')
    Item 5: offset = 392, tuple = ('100', '1')
    Item 6: offset = 416, tuple = ('200', '2')

Index toast: not loaded

(1 row)

step select_2: 
					SELECT * FROM o_test_1 ORDER BY val_1;
					SELECT orioledb_tbl_structure('o_test_1'::regclass,
												  'nue');

val_1|val_2
-----+-----
    1|  131
    2|  132
    3|  133
    4|  114
    5|  115
  100|    1
  200|    2
(7 rows)

orioledb_tbl_structure                                                                                                                                                                                                                                                                                                                                                                                                                                                                                                                                                                                                                                                                                                                                                                                                                        
----------------------------------------------------------------------------------------------------------------------------------------------------------------------------------------------------------------------------------------------------------------------------------------------------------------------------------------------------------------------------------------------------------------------------------------------------------------------------------------------------------------------------------------------------------------------------------------------------------------------------------------------------------------------------------------------------------------------------------------------------------------------------------------------------------------------------------------------
Index o_test_1_pkey contents
Page 0: level = 0, maxKeyLen = 8, nVacatedBytes = 0
state = free, datoid equal, relnode equal, ix_type = primary, dirty
    Leftmost, Rightmost
  Chunk 0: offset = 0, location = 256, hikey location = 64
    Item 0: mode = noKeyUpdate, undoLocation = 2, offset = 272, tuple = ('1', '131')
      Undo item: tuple = ('1', '111')
    Item 1: mode = noKeyUpdate, undoLocation = 0, offset = 296, tuple = ('2', '132')
      Undo item: tuple = ('2', '112')
    Item 2: mode = noKeyUpdate, undoLocation = 1, offset = 320, tuple = ('3', '133')
      Undo item: tuple = ('3', '113')
    Item 3: offset = 344, tuple = ('4', '114')
    Item 4: offset = 368, tuple = ('5', '115')
    Item 5: offset = 392, tuple = ('100', '1')
    Item 6: offset = 416, tuple = ('200', '2')

Index toast: not loaded

(1 row)

step commit_2: COMMIT;
step select_1: 
					SELECT * FROM o_test_1 ORDER BY val_1;
					SELECT orioledb_tbl_structure('o_test_1'::regclass,
												  'nue');

val_1|val_2
-----+-----
    1|  131
    2|  132
    3|  133
    4|  114
    5|  115
  100|    1
  200|    2
(7 rows)

orioledb_tbl_structure                                                                                                                                                                                                                                                                                                                                                                                                                                                                                                                                                                                    
----------------------------------------------------------------------------------------------------------------------------------------------------------------------------------------------------------------------------------------------------------------------------------------------------------------------------------------------------------------------------------------------------------------------------------------------------------------------------------------------------------------------------------------------------------------------------------------------------------
Index o_test_1_pkey contents
Page 0: level = 0, maxKeyLen = 8, nVacatedBytes = 0
state = free, datoid equal, relnode equal, ix_type = primary, dirty
    Leftmost, Rightmost
  Chunk 0: offset = 0, location = 256, hikey location = 64
    Item 0: offset = 272, tuple = ('1', '131')
    Item 1: offset = 296, tuple = ('2', '132')
    Item 2: offset = 320, tuple = ('3', '133')
    Item 3: offset = 344, tuple = ('4', '114')
    Item 4: offset = 368, tuple = ('5', '115')
    Item 5: offset = 392, tuple = ('100', '1')
    Item 6: offset = 416, tuple = ('200', '2')

Index toast: not loaded

(1 row)

step select_2: 
					SELECT * FROM o_test_1 ORDER BY val_1;
					SELECT orioledb_tbl_structure('o_test_1'::regclass,
												  'nue');

val_1|val_2
-----+-----
    1|  131
    2|  132
    3|  133
    4|  114
    5|  115
  100|    1
  200|    2
(7 rows)

orioledb_tbl_structure                                                                                                                                                                                                                                                                                                                                                                                                                                                                                                                                                                                    
----------------------------------------------------------------------------------------------------------------------------------------------------------------------------------------------------------------------------------------------------------------------------------------------------------------------------------------------------------------------------------------------------------------------------------------------------------------------------------------------------------------------------------------------------------------------------------------------------------
Index o_test_1_pkey contents
Page 0: level = 0, maxKeyLen = 8, nVacatedBytes = 0
state = free, datoid equal, relnode equal, ix_type = primary, dirty
    Leftmost, Rightmost
  Chunk 0: offset = 0, location = 256, hikey location = 64
    Item 0: offset = 272, tuple = ('1', '131')
    Item 1: offset = 296, tuple = ('2', '132')
    Item 2: offset = 320, tuple = ('3', '133')
    Item 3: offset = 344, tuple = ('4', '114')
    Item 4: offset = 368, tuple = ('5', '115')
    Item 5: offset = 392, tuple = ('100', '1')
    Item 6: offset = 416, tuple = ('200', '2')

Index toast: not loaded

(1 row)


starting permutation: begin_1 begin_2 begin_3 select_1 delete_1 insert_1_2 select_1 select_2 select_3 delete_2 select_1 select_3 update_3 select_1 commit_1 insert_2 select_1 select_2 commit_2 commit_3 select_1 select_2 select_3
step begin_1: BEGIN;
step begin_2: BEGIN;
step begin_3: BEGIN;
step select_1: 
					SELECT * FROM o_test_1 ORDER BY val_1;
					SELECT orioledb_tbl_structure('o_test_1'::regclass,
												  'nue');

val_1|val_2
-----+-----
    1|  101
    2|  102
    3|  103
    4|  104
    5|  105
(5 rows)

orioledb_tbl_structure                                                                                                                                                                                                                                                                                                                                                                                                                                                                                      
------------------------------------------------------------------------------------------------------------------------------------------------------------------------------------------------------------------------------------------------------------------------------------------------------------------------------------------------------------------------------------------------------------------------------------------------------------------------------------------------------------
Index o_test_1_pkey contents
Page 0: level = 0, maxKeyLen = 8, nVacatedBytes = 0
state = free, datoid equal, relnode equal, ix_type = primary, dirty
    Leftmost, Rightmost
  Chunk 0: offset = 0, location = 256, hikey location = 64
    Item 0: offset = 272, tuple = ('1', '101')
    Item 1: offset = 296, tuple = ('2', '102')
    Item 2: offset = 320, tuple = ('3', '103')
    Item 3: offset = 344, tuple = ('4', '104')
    Item 4: offset = 368, tuple = ('5', '105')

Index toast: not loaded

(1 row)

step delete_1: DELETE FROM o_test_1 WHERE val_1 = 1;
step insert_1_2: INSERT INTO o_test_1 VALUES (1, 1);
step select_1: 
					SELECT * FROM o_test_1 ORDER BY val_1;
					SELECT orioledb_tbl_structure('o_test_1'::regclass,
												  'nue');

val_1|val_2
-----+-----
    1|    1
    2|  102
    3|  103
    4|  104
    5|  105
(5 rows)

orioledb_tbl_structure                                                                                                                                                                                                                                                                                                                                                                                                                                                                                                                                                                                                                       
---------------------------------------------------------------------------------------------------------------------------------------------------------------------------------------------------------------------------------------------------------------------------------------------------------------------------------------------------------------------------------------------------------------------------------------------------------------------------------------------------------------------------------------------------------------------------------------------------------------------------------------------
Index o_test_1_pkey contents
Page 0: level = 0, maxKeyLen = 8, nVacatedBytes = 0
state = free, datoid equal, relnode equal, ix_type = primary, dirty
    Leftmost, Rightmost
  Chunk 0: offset = 0, location = 256, hikey location = 64
    Item 0: mode = update, undoLocation = 1, offset = 272, tuple = ('1', '1')
      Undo item: mode = update, deleted, undoLocation = 0, tuple = ('1', '101')
      Undo item: 
    Item 1: offset = 304, tuple = ('2', '102')
    Item 2: offset = 328, tuple = ('3', '103')
    Item 3: offset = 352, tuple = ('4', '104')
    Item 4: offset = 376, tuple = ('5', '105')

Index toast: not loaded

(1 row)

step select_2: 
					SELECT * FROM o_test_1 ORDER BY val_1;
					SELECT orioledb_tbl_structure('o_test_1'::regclass,
												  'nue');

val_1|val_2
-----+-----
    1|  101
    2|  102
    3|  103
    4|  104
    5|  105
(5 rows)

orioledb_tbl_structure                                                                                                                                                                                                                                                                                                                                                                                                                                                                                                                                                                                                                       
---------------------------------------------------------------------------------------------------------------------------------------------------------------------------------------------------------------------------------------------------------------------------------------------------------------------------------------------------------------------------------------------------------------------------------------------------------------------------------------------------------------------------------------------------------------------------------------------------------------------------------------------
Index o_test_1_pkey contents
Page 0: level = 0, maxKeyLen = 8, nVacatedBytes = 0
state = free, datoid equal, relnode equal, ix_type = primary, dirty
    Leftmost, Rightmost
  Chunk 0: offset = 0, location = 256, hikey location = 64
    Item 0: mode = update, undoLocation = 1, offset = 272, tuple = ('1', '1')
      Undo item: mode = update, deleted, undoLocation = 0, tuple = ('1', '101')
      Undo item: 
    Item 1: offset = 304, tuple = ('2', '102')
    Item 2: offset = 328, tuple = ('3', '103')
    Item 3: offset = 352, tuple = ('4', '104')
    Item 4: offset = 376, tuple = ('5', '105')

Index toast: not loaded

(1 row)

step select_3: 
					SELECT * FROM o_test_1 ORDER BY val_1;
					SELECT orioledb_tbl_structure('o_test_1'::regclass,
												  'nue');

val_1|val_2
-----+-----
    1|  101
    2|  102
    3|  103
    4|  104
    5|  105
(5 rows)

orioledb_tbl_structure                                                                                                                                                                                                                                                                                                                                                                                                                                                                                                                                                                                                                       
---------------------------------------------------------------------------------------------------------------------------------------------------------------------------------------------------------------------------------------------------------------------------------------------------------------------------------------------------------------------------------------------------------------------------------------------------------------------------------------------------------------------------------------------------------------------------------------------------------------------------------------------
Index o_test_1_pkey contents
Page 0: level = 0, maxKeyLen = 8, nVacatedBytes = 0
state = free, datoid equal, relnode equal, ix_type = primary, dirty
    Leftmost, Rightmost
  Chunk 0: offset = 0, location = 256, hikey location = 64
    Item 0: mode = update, undoLocation = 1, offset = 272, tuple = ('1', '1')
      Undo item: mode = update, deleted, undoLocation = 0, tuple = ('1', '101')
      Undo item: 
    Item 1: offset = 304, tuple = ('2', '102')
    Item 2: offset = 328, tuple = ('3', '103')
    Item 3: offset = 352, tuple = ('4', '104')
    Item 4: offset = 376, tuple = ('5', '105')

Index toast: not loaded

(1 row)

step delete_2: DELETE FROM o_test_1 WHERE val_1 = 1; <waiting ...>
step select_1: 
					SELECT * FROM o_test_1 ORDER BY val_1;
					SELECT orioledb_tbl_structure('o_test_1'::regclass,
												  'nue');

val_1|val_2
-----+-----
    1|    1
    2|  102
    3|  103
    4|  104
    5|  105
(5 rows)

orioledb_tbl_structure                                                                                                                                                                                                                                                                                                                                                                                                                                                                                                                                                                                                                       
---------------------------------------------------------------------------------------------------------------------------------------------------------------------------------------------------------------------------------------------------------------------------------------------------------------------------------------------------------------------------------------------------------------------------------------------------------------------------------------------------------------------------------------------------------------------------------------------------------------------------------------------
Index o_test_1_pkey contents
Page 0: level = 0, maxKeyLen = 8, nVacatedBytes = 0
state = free, datoid equal, relnode equal, ix_type = primary, dirty
    Leftmost, Rightmost
  Chunk 0: offset = 0, location = 256, hikey location = 64
    Item 0: mode = update, undoLocation = 1, offset = 272, tuple = ('1', '1')
      Undo item: mode = update, deleted, undoLocation = 0, tuple = ('1', '101')
      Undo item: 
    Item 1: offset = 304, tuple = ('2', '102')
    Item 2: offset = 328, tuple = ('3', '103')
    Item 3: offset = 352, tuple = ('4', '104')
    Item 4: offset = 376, tuple = ('5', '105')

Index toast: not loaded

(1 row)

step select_3: 
					SELECT * FROM o_test_1 ORDER BY val_1;
					SELECT orioledb_tbl_structure('o_test_1'::regclass,
												  'nue');

val_1|val_2
-----+-----
    1|  101
    2|  102
    3|  103
    4|  104
    5|  105
(5 rows)

orioledb_tbl_structure                                                                                                                                                                                                                                                                                                                                                                                                                                                                                                                                                                                                                       
---------------------------------------------------------------------------------------------------------------------------------------------------------------------------------------------------------------------------------------------------------------------------------------------------------------------------------------------------------------------------------------------------------------------------------------------------------------------------------------------------------------------------------------------------------------------------------------------------------------------------------------------
Index o_test_1_pkey contents
Page 0: level = 0, maxKeyLen = 8, nVacatedBytes = 0
state = free, datoid equal, relnode equal, ix_type = primary, dirty
    Leftmost, Rightmost
  Chunk 0: offset = 0, location = 256, hikey location = 64
    Item 0: mode = update, undoLocation = 1, offset = 272, tuple = ('1', '1')
      Undo item: mode = update, deleted, undoLocation = 0, tuple = ('1', '101')
      Undo item: 
    Item 1: offset = 304, tuple = ('2', '102')
    Item 2: offset = 328, tuple = ('3', '103')
    Item 3: offset = 352, tuple = ('4', '104')
    Item 4: offset = 376, tuple = ('5', '105')

Index toast: not loaded

(1 row)

step update_3: UPDATE o_test_1 SET val_2 = 3 WHERE val_1 = 1; <waiting ...>
step select_1: 
					SELECT * FROM o_test_1 ORDER BY val_1;
					SELECT orioledb_tbl_structure('o_test_1'::regclass,
												  'nue');

val_1|val_2
-----+-----
    1|    1
    2|  102
    3|  103
    4|  104
    5|  105
(5 rows)

orioledb_tbl_structure                                                                                                                                                                                                                                                                                                                                                                                                                                                                                                                                                                                                                       
---------------------------------------------------------------------------------------------------------------------------------------------------------------------------------------------------------------------------------------------------------------------------------------------------------------------------------------------------------------------------------------------------------------------------------------------------------------------------------------------------------------------------------------------------------------------------------------------------------------------------------------------
Index o_test_1_pkey contents
Page 0: level = 0, maxKeyLen = 8, nVacatedBytes = 0
state = free, datoid equal, relnode equal, ix_type = primary, dirty
    Leftmost, Rightmost
  Chunk 0: offset = 0, location = 256, hikey location = 64
    Item 0: mode = update, undoLocation = 1, offset = 272, tuple = ('1', '1')
      Undo item: mode = update, deleted, undoLocation = 0, tuple = ('1', '101')
      Undo item: 
    Item 1: offset = 304, tuple = ('2', '102')
    Item 2: offset = 328, tuple = ('3', '103')
    Item 3: offset = 352, tuple = ('4', '104')
    Item 4: offset = 376, tuple = ('5', '105')

Index toast: not loaded

(1 row)

step commit_1: COMMIT;
step delete_2: <... completed>
step update_3: <... completed>
step insert_2: INSERT INTO o_test_1 VALUES (1, 2);
ERROR:  duplicate key value violates unique constraint "o_test_1_pkey"
step select_1: 
					SELECT * FROM o_test_1 ORDER BY val_1;
					SELECT orioledb_tbl_structure('o_test_1'::regclass,
												  'nue');

val_1|val_2
-----+-----
    1|    1
    2|  102
    3|  103
    4|  104
    5|  105
(5 rows)

orioledb_tbl_structure                                                                                                                                                                                                                                                                                                                                                                                                                                                                                    
----------------------------------------------------------------------------------------------------------------------------------------------------------------------------------------------------------------------------------------------------------------------------------------------------------------------------------------------------------------------------------------------------------------------------------------------------------------------------------------------------------
Index o_test_1_pkey contents
Page 0: level = 0, maxKeyLen = 8, nVacatedBytes = 0
state = free, datoid equal, relnode equal, ix_type = primary, dirty
    Leftmost, Rightmost
  Chunk 0: offset = 0, location = 256, hikey location = 64
    Item 0: offset = 272, tuple = ('1', '1')
    Item 1: offset = 304, tuple = ('2', '102')
    Item 2: offset = 328, tuple = ('3', '103')
    Item 3: offset = 352, tuple = ('4', '104')
    Item 4: offset = 376, tuple = ('5', '105')

Index toast: not loaded

(1 row)

step select_2: 
					SELECT * FROM o_test_1 ORDER BY val_1;
					SELECT orioledb_tbl_structure('o_test_1'::regclass,
												  'nue');

ERROR:  current transaction is aborted, commands ignored until end of transaction block
step commit_2: COMMIT;
step commit_3: COMMIT;
step select_1: 
					SELECT * FROM o_test_1 ORDER BY val_1;
					SELECT orioledb_tbl_structure('o_test_1'::regclass,
												  'nue');

val_1|val_2
-----+-----
    1|    1
    2|  102
    3|  103
    4|  104
    5|  105
(5 rows)

orioledb_tbl_structure                                                                                                                                                                                                                                                                                                                                                                                                                                                                                    
----------------------------------------------------------------------------------------------------------------------------------------------------------------------------------------------------------------------------------------------------------------------------------------------------------------------------------------------------------------------------------------------------------------------------------------------------------------------------------------------------------
Index o_test_1_pkey contents
Page 0: level = 0, maxKeyLen = 8, nVacatedBytes = 0
state = free, datoid equal, relnode equal, ix_type = primary, dirty
    Leftmost, Rightmost
  Chunk 0: offset = 0, location = 256, hikey location = 64
    Item 0: offset = 272, tuple = ('1', '1')
    Item 1: offset = 304, tuple = ('2', '102')
    Item 2: offset = 328, tuple = ('3', '103')
    Item 3: offset = 352, tuple = ('4', '104')
    Item 4: offset = 376, tuple = ('5', '105')

Index toast: not loaded

(1 row)

step select_2: 
					SELECT * FROM o_test_1 ORDER BY val_1;
					SELECT orioledb_tbl_structure('o_test_1'::regclass,
												  'nue');

val_1|val_2
-----+-----
    1|    1
    2|  102
    3|  103
    4|  104
    5|  105
(5 rows)

orioledb_tbl_structure                                                                                                                                                                                                                                                                                                                                                                                                                                                                                    
----------------------------------------------------------------------------------------------------------------------------------------------------------------------------------------------------------------------------------------------------------------------------------------------------------------------------------------------------------------------------------------------------------------------------------------------------------------------------------------------------------
Index o_test_1_pkey contents
Page 0: level = 0, maxKeyLen = 8, nVacatedBytes = 0
state = free, datoid equal, relnode equal, ix_type = primary, dirty
    Leftmost, Rightmost
  Chunk 0: offset = 0, location = 256, hikey location = 64
    Item 0: offset = 272, tuple = ('1', '1')
    Item 1: offset = 304, tuple = ('2', '102')
    Item 2: offset = 328, tuple = ('3', '103')
    Item 3: offset = 352, tuple = ('4', '104')
    Item 4: offset = 376, tuple = ('5', '105')

Index toast: not loaded

(1 row)

step select_3: 
					SELECT * FROM o_test_1 ORDER BY val_1;
					SELECT orioledb_tbl_structure('o_test_1'::regclass,
												  'nue');

val_1|val_2
-----+-----
    1|    1
    2|  102
    3|  103
    4|  104
    5|  105
(5 rows)

orioledb_tbl_structure                                                                                                                                                                                                                                                                                                                                                                                                                                                                                    
----------------------------------------------------------------------------------------------------------------------------------------------------------------------------------------------------------------------------------------------------------------------------------------------------------------------------------------------------------------------------------------------------------------------------------------------------------------------------------------------------------
Index o_test_1_pkey contents
Page 0: level = 0, maxKeyLen = 8, nVacatedBytes = 0
state = free, datoid equal, relnode equal, ix_type = primary, dirty
    Leftmost, Rightmost
  Chunk 0: offset = 0, location = 256, hikey location = 64
    Item 0: offset = 272, tuple = ('1', '1')
    Item 1: offset = 304, tuple = ('2', '102')
    Item 2: offset = 328, tuple = ('3', '103')
    Item 3: offset = 352, tuple = ('4', '104')
    Item 4: offset = 376, tuple = ('5', '105')

Index toast: not loaded

(1 row)


starting permutation: begin_1 begin_2 begin_3 select_1 delete_1 insert_1_2 select_1 select_2 select_3 delete_2 select_1 select_3 update_3 select_1 rollback_1 insert_2 select_1 select_2 commit_2 commit_3 select_1 select_2 select_3
step begin_1: BEGIN;
step begin_2: BEGIN;
step begin_3: BEGIN;
step select_1: 
					SELECT * FROM o_test_1 ORDER BY val_1;
					SELECT orioledb_tbl_structure('o_test_1'::regclass,
												  'nue');

val_1|val_2
-----+-----
    1|  101
    2|  102
    3|  103
    4|  104
    5|  105
(5 rows)

orioledb_tbl_structure                                                                                                                                                                                                                                                                                                                                                                                                                                                                                      
------------------------------------------------------------------------------------------------------------------------------------------------------------------------------------------------------------------------------------------------------------------------------------------------------------------------------------------------------------------------------------------------------------------------------------------------------------------------------------------------------------
Index o_test_1_pkey contents
Page 0: level = 0, maxKeyLen = 8, nVacatedBytes = 0
state = free, datoid equal, relnode equal, ix_type = primary, dirty
    Leftmost, Rightmost
  Chunk 0: offset = 0, location = 256, hikey location = 64
    Item 0: offset = 272, tuple = ('1', '101')
    Item 1: offset = 296, tuple = ('2', '102')
    Item 2: offset = 320, tuple = ('3', '103')
    Item 3: offset = 344, tuple = ('4', '104')
    Item 4: offset = 368, tuple = ('5', '105')

Index toast: not loaded

(1 row)

step delete_1: DELETE FROM o_test_1 WHERE val_1 = 1;
step insert_1_2: INSERT INTO o_test_1 VALUES (1, 1);
step select_1: 
					SELECT * FROM o_test_1 ORDER BY val_1;
					SELECT orioledb_tbl_structure('o_test_1'::regclass,
												  'nue');

val_1|val_2
-----+-----
    1|    1
    2|  102
    3|  103
    4|  104
    5|  105
(5 rows)

orioledb_tbl_structure                                                                                                                                                                                                                                                                                                                                                                                                                                                                                                                                                                                                                       
---------------------------------------------------------------------------------------------------------------------------------------------------------------------------------------------------------------------------------------------------------------------------------------------------------------------------------------------------------------------------------------------------------------------------------------------------------------------------------------------------------------------------------------------------------------------------------------------------------------------------------------------
Index o_test_1_pkey contents
Page 0: level = 0, maxKeyLen = 8, nVacatedBytes = 0
state = free, datoid equal, relnode equal, ix_type = primary, dirty
    Leftmost, Rightmost
  Chunk 0: offset = 0, location = 256, hikey location = 64
    Item 0: mode = update, undoLocation = 1, offset = 272, tuple = ('1', '1')
      Undo item: mode = update, deleted, undoLocation = 0, tuple = ('1', '101')
      Undo item: 
    Item 1: offset = 304, tuple = ('2', '102')
    Item 2: offset = 328, tuple = ('3', '103')
    Item 3: offset = 352, tuple = ('4', '104')
    Item 4: offset = 376, tuple = ('5', '105')

Index toast: not loaded

(1 row)

step select_2: 
					SELECT * FROM o_test_1 ORDER BY val_1;
					SELECT orioledb_tbl_structure('o_test_1'::regclass,
												  'nue');

val_1|val_2
-----+-----
    1|  101
    2|  102
    3|  103
    4|  104
    5|  105
(5 rows)

orioledb_tbl_structure                                                                                                                                                                                                                                                                                                                                                                                                                                                                                                                                                                                                                       
---------------------------------------------------------------------------------------------------------------------------------------------------------------------------------------------------------------------------------------------------------------------------------------------------------------------------------------------------------------------------------------------------------------------------------------------------------------------------------------------------------------------------------------------------------------------------------------------------------------------------------------------
Index o_test_1_pkey contents
Page 0: level = 0, maxKeyLen = 8, nVacatedBytes = 0
state = free, datoid equal, relnode equal, ix_type = primary, dirty
    Leftmost, Rightmost
  Chunk 0: offset = 0, location = 256, hikey location = 64
    Item 0: mode = update, undoLocation = 1, offset = 272, tuple = ('1', '1')
      Undo item: mode = update, deleted, undoLocation = 0, tuple = ('1', '101')
      Undo item: 
    Item 1: offset = 304, tuple = ('2', '102')
    Item 2: offset = 328, tuple = ('3', '103')
    Item 3: offset = 352, tuple = ('4', '104')
    Item 4: offset = 376, tuple = ('5', '105')

Index toast: not loaded

(1 row)

step select_3: 
					SELECT * FROM o_test_1 ORDER BY val_1;
					SELECT orioledb_tbl_structure('o_test_1'::regclass,
												  'nue');

val_1|val_2
-----+-----
    1|  101
    2|  102
    3|  103
    4|  104
    5|  105
(5 rows)

orioledb_tbl_structure                                                                                                                                                                                                                                                                                                                                                                                                                                                                                                                                                                                                                       
---------------------------------------------------------------------------------------------------------------------------------------------------------------------------------------------------------------------------------------------------------------------------------------------------------------------------------------------------------------------------------------------------------------------------------------------------------------------------------------------------------------------------------------------------------------------------------------------------------------------------------------------
Index o_test_1_pkey contents
Page 0: level = 0, maxKeyLen = 8, nVacatedBytes = 0
state = free, datoid equal, relnode equal, ix_type = primary, dirty
    Leftmost, Rightmost
  Chunk 0: offset = 0, location = 256, hikey location = 64
    Item 0: mode = update, undoLocation = 1, offset = 272, tuple = ('1', '1')
      Undo item: mode = update, deleted, undoLocation = 0, tuple = ('1', '101')
      Undo item: 
    Item 1: offset = 304, tuple = ('2', '102')
    Item 2: offset = 328, tuple = ('3', '103')
    Item 3: offset = 352, tuple = ('4', '104')
    Item 4: offset = 376, tuple = ('5', '105')

Index toast: not loaded

(1 row)

step delete_2: DELETE FROM o_test_1 WHERE val_1 = 1; <waiting ...>
step select_1: 
					SELECT * FROM o_test_1 ORDER BY val_1;
					SELECT orioledb_tbl_structure('o_test_1'::regclass,
												  'nue');

val_1|val_2
-----+-----
    1|    1
    2|  102
    3|  103
    4|  104
    5|  105
(5 rows)

orioledb_tbl_structure                                                                                                                                                                                                                                                                                                                                                                                                                                                                                                                                                                                                                       
---------------------------------------------------------------------------------------------------------------------------------------------------------------------------------------------------------------------------------------------------------------------------------------------------------------------------------------------------------------------------------------------------------------------------------------------------------------------------------------------------------------------------------------------------------------------------------------------------------------------------------------------
Index o_test_1_pkey contents
Page 0: level = 0, maxKeyLen = 8, nVacatedBytes = 0
state = free, datoid equal, relnode equal, ix_type = primary, dirty
    Leftmost, Rightmost
  Chunk 0: offset = 0, location = 256, hikey location = 64
    Item 0: mode = update, undoLocation = 1, offset = 272, tuple = ('1', '1')
      Undo item: mode = update, deleted, undoLocation = 0, tuple = ('1', '101')
      Undo item: 
    Item 1: offset = 304, tuple = ('2', '102')
    Item 2: offset = 328, tuple = ('3', '103')
    Item 3: offset = 352, tuple = ('4', '104')
    Item 4: offset = 376, tuple = ('5', '105')

Index toast: not loaded

(1 row)

step select_3: 
					SELECT * FROM o_test_1 ORDER BY val_1;
					SELECT orioledb_tbl_structure('o_test_1'::regclass,
												  'nue');

val_1|val_2
-----+-----
    1|  101
    2|  102
    3|  103
    4|  104
    5|  105
(5 rows)

orioledb_tbl_structure                                                                                                                                                                                                                                                                                                                                                                                                                                                                                                                                                                                                                       
---------------------------------------------------------------------------------------------------------------------------------------------------------------------------------------------------------------------------------------------------------------------------------------------------------------------------------------------------------------------------------------------------------------------------------------------------------------------------------------------------------------------------------------------------------------------------------------------------------------------------------------------
Index o_test_1_pkey contents
Page 0: level = 0, maxKeyLen = 8, nVacatedBytes = 0
state = free, datoid equal, relnode equal, ix_type = primary, dirty
    Leftmost, Rightmost
  Chunk 0: offset = 0, location = 256, hikey location = 64
    Item 0: mode = update, undoLocation = 1, offset = 272, tuple = ('1', '1')
      Undo item: mode = update, deleted, undoLocation = 0, tuple = ('1', '101')
      Undo item: 
    Item 1: offset = 304, tuple = ('2', '102')
    Item 2: offset = 328, tuple = ('3', '103')
    Item 3: offset = 352, tuple = ('4', '104')
    Item 4: offset = 376, tuple = ('5', '105')

Index toast: not loaded

(1 row)

step update_3: UPDATE o_test_1 SET val_2 = 3 WHERE val_1 = 1; <waiting ...>
step select_1: 
					SELECT * FROM o_test_1 ORDER BY val_1;
					SELECT orioledb_tbl_structure('o_test_1'::regclass,
												  'nue');

val_1|val_2
-----+-----
    1|    1
    2|  102
    3|  103
    4|  104
    5|  105
(5 rows)

orioledb_tbl_structure                                                                                                                                                                                                                                                                                                                                                                                                                                                                                                                                                                                                                       
---------------------------------------------------------------------------------------------------------------------------------------------------------------------------------------------------------------------------------------------------------------------------------------------------------------------------------------------------------------------------------------------------------------------------------------------------------------------------------------------------------------------------------------------------------------------------------------------------------------------------------------------
Index o_test_1_pkey contents
Page 0: level = 0, maxKeyLen = 8, nVacatedBytes = 0
state = free, datoid equal, relnode equal, ix_type = primary, dirty
    Leftmost, Rightmost
  Chunk 0: offset = 0, location = 256, hikey location = 64
    Item 0: mode = update, undoLocation = 1, offset = 272, tuple = ('1', '1')
      Undo item: mode = update, deleted, undoLocation = 0, tuple = ('1', '101')
      Undo item: 
    Item 1: offset = 304, tuple = ('2', '102')
    Item 2: offset = 328, tuple = ('3', '103')
    Item 3: offset = 352, tuple = ('4', '104')
    Item 4: offset = 376, tuple = ('5', '105')

Index toast: not loaded

(1 row)

step rollback_1: ROLLBACK;
step delete_2: <... completed>
step insert_2: INSERT INTO o_test_1 VALUES (1, 2);
step select_1: 
					SELECT * FROM o_test_1 ORDER BY val_1;
					SELECT orioledb_tbl_structure('o_test_1'::regclass,
												  'nue');

val_1|val_2
-----+-----
    1|  101
    2|  102
    3|  103
    4|  104
    5|  105
(5 rows)

orioledb_tbl_structure                                                                                                                                                                                                                                                                                                                                                                                                                                                                                                                                                                                                                       
---------------------------------------------------------------------------------------------------------------------------------------------------------------------------------------------------------------------------------------------------------------------------------------------------------------------------------------------------------------------------------------------------------------------------------------------------------------------------------------------------------------------------------------------------------------------------------------------------------------------------------------------
Index o_test_1_pkey contents
Page 0: level = 0, maxKeyLen = 8, nVacatedBytes = 8
state = free, datoid equal, relnode equal, ix_type = primary, dirty
    Leftmost, Rightmost
  Chunk 0: offset = 0, location = 256, hikey location = 64
    Item 0: mode = update, undoLocation = 1, offset = 272, tuple = ('1', '2')
      Undo item: mode = update, deleted, undoLocation = 0, tuple = ('1', '101')
      Undo item: 
    Item 1: offset = 304, tuple = ('2', '102')
    Item 2: offset = 328, tuple = ('3', '103')
    Item 3: offset = 352, tuple = ('4', '104')
    Item 4: offset = 376, tuple = ('5', '105')

Index toast: not loaded

(1 row)

step select_2: 
					SELECT * FROM o_test_1 ORDER BY val_1;
					SELECT orioledb_tbl_structure('o_test_1'::regclass,
												  'nue');

val_1|val_2
-----+-----
    1|    2
    2|  102
    3|  103
    4|  104
    5|  105
(5 rows)

orioledb_tbl_structure                                                                                                                                                                                                                                                                                                                                                                                                                                                                                                                                                                                                                       
---------------------------------------------------------------------------------------------------------------------------------------------------------------------------------------------------------------------------------------------------------------------------------------------------------------------------------------------------------------------------------------------------------------------------------------------------------------------------------------------------------------------------------------------------------------------------------------------------------------------------------------------
Index o_test_1_pkey contents
Page 0: level = 0, maxKeyLen = 8, nVacatedBytes = 8
state = free, datoid equal, relnode equal, ix_type = primary, dirty
    Leftmost, Rightmost
  Chunk 0: offset = 0, location = 256, hikey location = 64
    Item 0: mode = update, undoLocation = 1, offset = 272, tuple = ('1', '2')
      Undo item: mode = update, deleted, undoLocation = 0, tuple = ('1', '101')
      Undo item: 
    Item 1: offset = 304, tuple = ('2', '102')
    Item 2: offset = 328, tuple = ('3', '103')
    Item 3: offset = 352, tuple = ('4', '104')
    Item 4: offset = 376, tuple = ('5', '105')

Index toast: not loaded

(1 row)

step commit_2: COMMIT;
step update_3: <... completed>
step commit_3: COMMIT;
step select_1: 
					SELECT * FROM o_test_1 ORDER BY val_1;
					SELECT orioledb_tbl_structure('o_test_1'::regclass,
												  'nue');

val_1|val_2
-----+-----
    1|    2
    2|  102
    3|  103
    4|  104
    5|  105
(5 rows)

orioledb_tbl_structure                                                                                                                                                                                                                                                                                                                                                                                                                                                                                    
----------------------------------------------------------------------------------------------------------------------------------------------------------------------------------------------------------------------------------------------------------------------------------------------------------------------------------------------------------------------------------------------------------------------------------------------------------------------------------------------------------
Index o_test_1_pkey contents
Page 0: level = 0, maxKeyLen = 8, nVacatedBytes = 8
state = free, datoid equal, relnode equal, ix_type = primary, dirty
    Leftmost, Rightmost
  Chunk 0: offset = 0, location = 256, hikey location = 64
    Item 0: offset = 272, tuple = ('1', '2')
    Item 1: offset = 304, tuple = ('2', '102')
    Item 2: offset = 328, tuple = ('3', '103')
    Item 3: offset = 352, tuple = ('4', '104')
    Item 4: offset = 376, tuple = ('5', '105')

Index toast: not loaded

(1 row)

step select_2: 
					SELECT * FROM o_test_1 ORDER BY val_1;
					SELECT orioledb_tbl_structure('o_test_1'::regclass,
												  'nue');

val_1|val_2
-----+-----
    1|    2
    2|  102
    3|  103
    4|  104
    5|  105
(5 rows)

orioledb_tbl_structure                                                                                                                                                                                                                                                                                                                                                                                                                                                                                    
----------------------------------------------------------------------------------------------------------------------------------------------------------------------------------------------------------------------------------------------------------------------------------------------------------------------------------------------------------------------------------------------------------------------------------------------------------------------------------------------------------
Index o_test_1_pkey contents
Page 0: level = 0, maxKeyLen = 8, nVacatedBytes = 8
state = free, datoid equal, relnode equal, ix_type = primary, dirty
    Leftmost, Rightmost
  Chunk 0: offset = 0, location = 256, hikey location = 64
    Item 0: offset = 272, tuple = ('1', '2')
    Item 1: offset = 304, tuple = ('2', '102')
    Item 2: offset = 328, tuple = ('3', '103')
    Item 3: offset = 352, tuple = ('4', '104')
    Item 4: offset = 376, tuple = ('5', '105')

Index toast: not loaded

(1 row)

step select_3: 
					SELECT * FROM o_test_1 ORDER BY val_1;
					SELECT orioledb_tbl_structure('o_test_1'::regclass,
												  'nue');

val_1|val_2
-----+-----
    1|    2
    2|  102
    3|  103
    4|  104
    5|  105
(5 rows)

orioledb_tbl_structure                                                                                                                                                                                                                                                                                                                                                                                                                                                                                    
----------------------------------------------------------------------------------------------------------------------------------------------------------------------------------------------------------------------------------------------------------------------------------------------------------------------------------------------------------------------------------------------------------------------------------------------------------------------------------------------------------
Index o_test_1_pkey contents
Page 0: level = 0, maxKeyLen = 8, nVacatedBytes = 8
state = free, datoid equal, relnode equal, ix_type = primary, dirty
    Leftmost, Rightmost
  Chunk 0: offset = 0, location = 256, hikey location = 64
    Item 0: offset = 272, tuple = ('1', '2')
    Item 1: offset = 304, tuple = ('2', '102')
    Item 2: offset = 328, tuple = ('3', '103')
    Item 3: offset = 352, tuple = ('4', '104')
    Item 4: offset = 376, tuple = ('5', '105')

Index toast: not loaded

(1 row)

